Image,Id
2eef038cc.jpg,w_9387099 new_whale w_79eb216 w_41429ea w_5482351
2e6401fb0.jpg,new_whale w_a68bac6 w_2a7c1af w_f6a16aa w_3c254c1
4188acc6e.jpg,w_867569a new_whale w_242fb46 w_f5aadde w_49e0d44
e1ab034fc.jpg,w_abd9d0b new_whale w_bd25728 w_d4fc12d w_99d33cf
b62b652a3.jpg,w_1d7fd7d new_whale w_bb56867 w_c2c20eb w_ba01717
0c1f975f3.jpg,w_a046389 new_whale w_f71100b w_a059841 w_dc23fbc
28951b661.jpg,w_f6c5343 new_whale w_28218e1 w_a0534e5 w_2500327
3dd105781.jpg,w_144ecb6 new_whale w_83e8a3e w_dbf6385 w_07c946d
6d57346c3.jpg,w_095e3eb new_whale w_57abc0f w_c9628f2 w_e026c82
bf5c08752.jpg,w_c01b2e9 new_whale w_eeea781 w_49ce813 w_99545ba
79853ff3b.jpg,w_6d59878 new_whale w_9364343 w_b28898a w_cc86d58
45708aeeb.jpg,w_7b703d1 new_whale w_4b66b5f w_d24c654 w_6db266a
28ed504e1.jpg,w_bc4da71 new_whale w_d066f46 w_ddc5518 w_ace2814
d2bca8b4b.jpg,new_whale w_cc57ddc w_d909f72 w_711552b w_179c9f0
6af9f80c7.jpg,new_whale w_a689d7a w_e6325d7 w_955bfe2 w_fd3e556
5b8f3af0a.jpg,w_f48451c new_whale w_c566a3d w_f24a55c w_aec2b6d
f505880b6.jpg,w_accb0cb new_whale w_3217fd7 w_b4db669 w_a8276b4
f6871ea12.jpg,w_c5935ae new_whale w_f666bb4 w_538259a w_8c25681
17aa93866.jpg,w_fccccec new_whale w_e4d305b w_872f131 w_d12e2eb
fc54d12aa.jpg,new_whale w_ef439a1 w_16df050 w_5841fb9 w_3d88ad4
10bf25ffb.jpg,w_67153b4 new_whale w_719ee7e w_3ae4d85 w_35f2f8d
dee1f5b0a.jpg,w_7d09141 new_whale w_f10d0eb w_c5260b8 w_d066c0a
11a9d11e8.jpg,w_db96784 new_whale w_0bc078c w_f382f59 w_2df85e7
c454c5e60.jpg,w_d573a68 new_whale w_733e9cc w_d66d8f4 w_107b98e
2fcc0d705.jpg,w_009c9c5 new_whale w_9cea9cf w_b67fcb9 w_0bdb7a5
52d9d12a9.jpg,w_3815890 new_whale w_aee1ccf w_34ecf36 w_a473267
f35ac2e50.jpg,new_whale w_488865e w_990921b w_b3cc7b3 w_b164c63
c97830465.jpg,w_bf2b915 new_whale w_2644b11 w_d9a3c6e w_1af6b9a
02d8e1e1f.jpg,w_3128adb new_whale w_0729126 w_af48048 w_79cfcab
b7aa709b7.jpg,new_whale w_872f131 w_9ba4a9a w_650f587 w_9d840d6
e357a55b7.jpg,w_181ab06 new_whale w_97f4b38 w_2d6bb89 w_c10fcb2
b5481f93b.jpg,w_bff3c3b new_whale w_5597026 w_98cc97d w_52cd115
f9ccc0224.jpg,w_8b3a8b3 new_whale w_c20b4e0 w_e2372d6 w_cb4d3ed
39d529166.jpg,w_b4ab5b5 new_whale w_9739508 w_8431ae8 w_04f5f55
ab81493b5.jpg,w_ffe8693 new_whale w_e34ff4a w_d405854 w_c1b34d2
67cc66ac5.jpg,w_ae8982d new_whale w_bc285a6 w_5f31117 w_da2cf74
8f14df8c6.jpg,w_6dbfd7a w_993320b new_whale w_ebe9709 w_8f424c5
19e987165.jpg,w_ea7bc89 new_whale w_d1c9d7e w_c2426a1 w_1d830c2
e1060f178.jpg,w_685d7a7 new_whale w_f4605bf w_e6dfc39 w_7918564
9269bb35c.jpg,new_whale w_b874a6f w_9a9a2c8 w_a84be0c w_04c9b23
2fe4ec2d5.jpg,w_919f33b w_a2f8488 new_whale w_698fcbe w_090c801
8614122aa.jpg,w_5e94510 new_whale w_4b04d0f w_900c68f w_5c028f2
9e5649ba2.jpg,w_7b06e7e new_whale w_e86689c w_c63c580 w_4846b27
4b24dd763.jpg,w_4ab3420 new_whale w_94a7669 w_2c94198 w_3f0fd95
a9b537478.jpg,w_260a2e7 new_whale w_26aeb61 w_584e1dc w_98e83cc
870d71bbe.jpg,new_whale w_ecbd28f w_2a6d5ee w_c25d2d1 w_20eeb29
5956e4510.jpg,w_614b549 new_whale w_e01ca20 w_76dee7c w_1531bf5
724a7c2a9.jpg,new_whale w_b19f2f9 w_4e40657 w_e2fd1e1 w_4982a49
bda06bd79.jpg,w_14ece76 new_whale w_ff6065f w_9728637 w_9287505
224dfd578.jpg,w_f6bae1a new_whale w_abee142 w_7432816 w_d7ef410
0e45a186a.jpg,new_whale w_34f5f2d w_24b2561 w_0b4f7cf w_db602dc
6af6458db.jpg,w_2f87cc7 new_whale w_7e579dd w_19671ad w_01fc429
485da78bd.jpg,w_5f5f9ae new_whale w_88445b2 w_e53ba4a w_ec16cc4
a0f38fccb.jpg,w_84a32d1 w_397d143 new_whale w_ab2ac77 w_ca1d5a8
98b6cee22.jpg,w_64cddcd new_whale w_23852a0 w_eec4e46 w_d892cd9
e0f0052d4.jpg,w_a684b05 new_whale w_7656c1a w_76d1f84 w_4ab6b16
d2712bce3.jpg,w_5b40032 new_whale w_281a8cd w_6332313 w_22f2567
5a971e786.jpg,w_65e0628 new_whale w_d8ae71c w_ea7bbc6 w_5a2634c
4df0f5618.jpg,new_whale w_aae547d w_76b8e6f w_bc677de w_8739af5
063aa0d9c.jpg,w_afe18e4 new_whale w_a939b64 w_73b6699 w_5b8f665
94c9b52fb.jpg,w_e64d9d1 new_whale w_66dd189 w_7087c88 w_a1d016d
a57163a66.jpg,w_fa52b0c new_whale w_c76f8f4 w_1554173 w_7918564
d8c4e6e9e.jpg,new_whale w_c17a2d4 w_291b418 w_38fc953 w_2f67f0a
8d8c7a728.jpg,w_1579152 new_whale w_d494351 w_550dd10 w_af7a56f
2bde706c0.jpg,w_cc86d58 new_whale w_122e247 w_6d59878 w_7edfc70
886b500bc.jpg,w_08630fd new_whale w_0135f5f w_efbdcbc w_c148ab4
3ad0d3a08.jpg,w_51fc1fc new_whale w_55782b0 w_722a04a w_e3582ac
e57463d0f.jpg,w_45246db new_whale w_2b388fe w_27aa28c w_5365497
8f6fc3ba5.jpg,w_3fe5d56 new_whale w_b7d68af w_088cda7 w_f24a55c
bce907bdc.jpg,w_cb88c1b w_fbcfe74 new_whale w_9f2cfff w_3f21fed
f19a63014.jpg,w_33696ac new_whale w_fec331a w_5b8805a w_180e241
270e405fb.jpg,w_c928809 new_whale w_8cad422 w_792ffd7 w_025911c
2b9ad3e83.jpg,new_whale w_7d4d7cd w_4460861 w_6e7cf1c w_74ada4e
bfed3fbfb.jpg,w_26923f7 new_whale w_b4ac550 w_3bd976e w_bec9c95
2a198ca6e.jpg,w_2e1416e new_whale w_f9fd8f9 w_025911c w_b9c99cc
cef9490d9.jpg,w_cdeac94 w_df4b60a new_whale w_7e56d66 w_e4ed810
7b5b51cce.jpg,w_bfe77d0 new_whale w_82479e4 w_7e1ce0a w_adedd1f
be9af0799.jpg,new_whale w_e4a9205 w_553d1ef w_a26cf66 w_a5c74f4
e9cd25335.jpg,w_e71f9c7 w_f437f82 new_whale w_addd610 w_56af0a9
b994a2b0f.jpg,w_54b631b new_whale w_0b3e0e6 w_227e394 w_5fb70a0
1a7b8b905.jpg,w_a2f8488 new_whale w_b475feb w_a586dce w_e1c5b57
33380ae50.jpg,w_36f91ad new_whale w_5808373 w_0369a5c w_29c0caf
5f33b1e7f.jpg,new_whale w_515bd01 w_ed620af w_bc285a6 w_be6e58a
cc47b0982.jpg,new_whale w_a3cbe89 w_38e4345 w_d2e4f28 w_c01b2e9
ef2c3e83c.jpg,new_whale w_082978e w_c3d896a w_f3252ff w_2a946f2
aa8b44ee0.jpg,w_c1efffb new_whale w_a9a4878 w_bef0a5d w_659bdb8
ddeac7526.jpg,w_7ab2120 new_whale w_a6a732d w_2ca9282 w_394f053
b7881de18.jpg,w_317c071 new_whale w_b385045 w_96c6613 w_fec5547
c398dd4d0.jpg,w_a009604 new_whale w_778e474 w_f077a03 w_e45491e
07774838f.jpg,w_8ea0c7d w_6caff0f new_whale w_c94f151 w_6e7763b
6c6e840df.jpg,new_whale w_cf8cd88 w_94dcd2b w_3729146 w_84b1b28
610ca8e78.jpg,new_whale w_fe87282 w_c178f34 w_45e0e10 w_7b07041
d6c30a166.jpg,w_9664ca8 new_whale w_2a1a012 w_5a2634c w_14e1334
f787f9502.jpg,w_56c9d4e new_whale w_9032a74 w_733e9cc w_cc93694
a97a36835.jpg,w_dfe485f new_whale w_7488eec w_dc56028 w_a5c74f4
b644ba07b.jpg,w_9e5854c new_whale w_0dd4a5d w_f2dd08f w_6bab2bd
863b6e6fb.jpg,w_e3ceadb new_whale w_dd88965 w_05d65b9 w_ae53e45
9ecf3864e.jpg,new_whale w_a386d0b w_c509e1e w_981075b w_f08fb81
b6d928250.jpg,w_f50b00d new_whale w_d97c490 w_f0fe284 w_56d38d8
4cccd5b04.jpg,new_whale w_85a2285 w_a8b65e2 w_3ec7fa2 w_972e7db
0aa099dec.jpg,new_whale w_e8e08e6 w_3511bc7 w_c6d75ff w_0c5f019
4f9a12406.jpg,w_1f6de0b new_whale w_ae8982d w_45e98c0 w_494c72d
1ea4f6223.jpg,w_b2341d4 w_1032bb6 new_whale w_2a2bcf1 w_73d71d2
69ad4e7ee.jpg,w_de8def8 new_whale w_40a1403 w_0f8ab07 w_72e3fa4
97cc0288f.jpg,w_20930e7 new_whale w_13c1b55 w_6cf6bf4 w_d909f72
c455ed9a2.jpg,w_8fb247e new_whale w_94dcd2b w_41dd026 w_1d9592f
2d3935fb4.jpg,new_whale w_6ad771b w_329c19c w_691b684 w_d947e85
259f879c9.jpg,w_eadfd82 new_whale w_9cf0388 w_bad166a w_fe94155
38f24831e.jpg,w_0135f5f new_whale w_27597ff w_6e51c06 w_3eae264
f4fc97dfb.jpg,w_103aca2 new_whale w_787af6b w_2034344 w_fcdda4c
525f23505.jpg,new_whale w_b7ad0fb w_6cda039 w_53d3f73 w_662530e
80745de9f.jpg,w_b3196aa new_whale w_94f41dc w_5c51475 w_b5e6c80
048574198.jpg,w_97ba78a new_whale w_6e55e73 w_e11afff w_a7067d1
959a7a3bb.jpg,w_f2075ef new_whale w_27a6304 w_8694cb5 w_d066c0a
5ab7f8a5c.jpg,w_e0a42ad new_whale w_aeabde9 w_a3ce1d5 w_d006897
6caa3aa93.jpg,new_whale w_8b1f4be w_a770c8f w_17c9df5 w_3137898
22eabdaa7.jpg,w_6465d75 new_whale w_6a95be3 w_5ad70f3 w_f57fb81
3a4640adf.jpg,new_whale w_715c34b w_a08f3cd w_1b04c3c w_9c08fc2
defe801d3.jpg,w_67b3af9 new_whale w_c536a4a w_7f762d8 w_fd98539
498571d09.jpg,new_whale w_4ac340b w_8d52508 w_81da9a5 w_ae19ff0
62ac56b8f.jpg,w_030e2cf new_whale w_4dcc907 w_2694603 w_f13f7b3
7980158cf.jpg,w_20dfb69 new_whale w_9d86594 w_8de77f8 w_a47dc2d
a45bdef93.jpg,w_72288ee new_whale w_7d6527e w_ea6a7fe w_b34830b
4bc14831a.jpg,w_325f8d2 new_whale w_3c629a2 w_3f5c708 w_6e85f95
802fd4adc.jpg,w_b2606f3 new_whale w_a1d016d w_456646a w_3f567ce
f9ce3e4aa.jpg,w_3962169 new_whale w_4524517 w_56d38d8 w_3b15259
0f905da69.jpg,w_056913a new_whale w_0e7aae1 w_4b8638b w_dced3f2
174ddc7cd.jpg,w_1d55e83 new_whale w_67fa427 w_3e18700 w_b2bc0c9
ba3f3e164.jpg,w_5557f1e new_whale w_9472e22 w_20930e7 w_deda5f7
8579eb3d1.jpg,w_749dffd new_whale w_6f0cbe3 w_093d284 w_16b5050
477ed5052.jpg,w_f765256 w_08630fd new_whale w_5485228 w_20baeef
19439c3a5.jpg,w_2424e82 new_whale w_921cdae w_51fc1fc w_454df60
bdc71d45a.jpg,w_0718183 new_whale w_780c931 w_23d4815 w_fbcfe74
eb47ccd55.jpg,w_d9e7ed3 new_whale w_0abe9e7 w_dadaa2e w_df1f698
6b3d78e6b.jpg,w_adcaf2a new_whale w_81da9a5 w_343f088 w_72c56cc
72b9ba939.jpg,w_4132bb8 new_whale w_46796cc w_ae393cd w_a2a40d2
3b64625c5.jpg,w_1c6465a new_whale w_5010896 w_d9c9d8d w_69a58b2
98c9a68ee.jpg,new_whale w_7330627 w_d6ca28d w_eaf9662 w_2ff0834
7a9f5ed3b.jpg,new_whale w_090c08a w_2d5b0e1 w_6fe3dac w_67153b4
b22c3568c.jpg,new_whale w_af367c3 w_eec4e46 w_47daed4 w_f119baa
acd78d4d2.jpg,w_4dfeafc w_db86325 new_whale w_fccccec w_c190aa8
841dde4bb.jpg,w_8230e8f new_whale w_ed29ffe w_d602efb w_6822dbc
6400a5dae.jpg,w_aebdb5f new_whale w_8ef9b33 w_5650932 w_082f603
bcca40612.jpg,w_89f521e new_whale w_ecad2c9 w_9b9602c w_f70c302
efac7e263.jpg,w_a5a0a57 new_whale w_60b027a w_b34830b w_ad88c85
09232fe8c.jpg,w_90c9763 new_whale w_a11932d w_8193215 w_6b41a2c
64ea6fe05.jpg,new_whale w_ee61a1f w_00904a7 w_27272a5 w_9785e30
1d88daf8d.jpg,new_whale w_0c7ab0d w_6c4a986 w_8d09425 w_e94b46a
0a21bfb1a.jpg,w_9ad05a6 new_whale w_a41147a w_9544084 w_694a615
41c670582.jpg,w_32eac70 w_f0cf3f6 new_whale w_3d1f606 w_2df85e7
2247ccbe4.jpg,w_565d73a new_whale w_5072c08 w_f2075ef w_c1d2d7f
45b89a418.jpg,w_94c3bf0 new_whale w_de657c1 w_76b8e6f w_662c89b
a393fa65c.jpg,w_2d5492b new_whale w_c62ac72 w_2af46a8 w_59088ff
6523f1af2.jpg,new_whale w_e918d4c w_c875e45 w_88eaa39 w_c5260b8
8fafd60e2.jpg,w_242fb46 new_whale w_7547b9a w_76d1f84 w_bd06bf9
feec05a6a.jpg,w_f035513 new_whale w_c8bbb43 w_f48451c w_c156d0a
c414e98a3.jpg,w_d77337e new_whale w_772c726 w_1be76f5 w_4951cb9
7ed205c6c.jpg,w_bf2b915 new_whale w_550dd10 w_92cb6d9 w_4f44a61
a432e954b.jpg,w_26c0ffd new_whale w_a684b05 w_0ad0f5b w_d3e4d19
eb349c1e2.jpg,new_whale w_e73cce3 w_28a16b0 w_576026e w_cee684e
34e43df4f.jpg,w_17f5d1d new_whale w_ec7e60a w_3a241cf w_9a1f31b
91a2055e1.jpg,w_4096187 new_whale w_717756b w_1de6148 w_5d36478
ecfaca9c3.jpg,w_8075847 new_whale w_98f16af w_b785729 w_3d1f606
4ad2260ee.jpg,new_whale w_2059146 w_84d832d w_34941d8 w_3ff114c
f26db09b5.jpg,w_6e55e73 new_whale w_a123aa1 w_010f858 w_97ba78a
394a17899.jpg,w_8cad422 new_whale w_c928809 w_c172767 w_38de45d
65fd236f0.jpg,new_whale w_0f8b8e2 w_ebe9709 w_f0ba4a2 w_38de45d
962c11b13.jpg,w_deb9471 new_whale w_0a87ea4 w_07e0c3c w_e1f57e7
d90bc576e.jpg,w_002c810 new_whale w_b5657c7 w_396c12b w_17338da
77ceb9ebb.jpg,w_9cf0388 w_fe94155 new_whale w_7648ac1 w_5d35047
0ff9cd790.jpg,w_cfce505 new_whale w_23bfd0a w_adb1dff w_aaf5ab5
f75238104.jpg,w_1ef6c12 new_whale w_46a38a6 w_2f94559 w_513f024
7fd675d90.jpg,w_1f8621d new_whale w_f6eed29 w_2330989 w_8261f4d
982ee7184.jpg,w_fdfd867 w_c1d2fbe new_whale w_f74a89e w_50260e7
39ab09fa4.jpg,new_whale w_d307d9d w_662530e w_11d8c70 w_5485228
db9f2937c.jpg,w_9a9a2c8 new_whale w_e9e413e w_789c969 w_9525c07
7d77db508.jpg,w_a074110 new_whale w_63b91aa w_4ea4f59 w_9b69214
a4b437e94.jpg,new_whale w_e6ff725 w_d24c654 w_7091e67 w_26b24d4
73e0af106.jpg,w_f9aab0c new_whale w_0513962 w_94f41dc w_d6ca28d
f4613a2f8.jpg,new_whale w_ace2814 w_44c1eef w_f57140c w_32de0c5
d5ecb8060.jpg,w_510f3ee new_whale w_8ab401c w_f992eae w_2548d54
31c7f1e4c.jpg,w_1032bb6 new_whale w_b2341d4 w_d588fb4 w_4ff2f4a
608a17bfe.jpg,w_012678c w_f497e3f new_whale w_6640084 w_1fe6c6e
cb569f4b4.jpg,w_71a1a08 new_whale w_a009604 w_b34830b w_aee1ccf
efd1ae9d2.jpg,w_2f1488c w_c9b4607 new_whale w_81ed5f8 w_b5c90a5
715b9f9d9.jpg,w_e27bbf6 new_whale w_857cb95 w_b3cc7b3 w_fd0d9a2
0474bf615.jpg,w_e93b569 new_whale w_03e3e5e w_acf8fd1 w_48b1730
eef85c0b7.jpg,w_61b9586 new_whale w_26c0ffd w_d3b1733 w_953b7b2
4f3ea827d.jpg,w_df32eec new_whale w_89f6097 w_a4fb1d8 w_336e046
ba7a23368.jpg,w_bab14fa new_whale w_c4faf7d w_44479bb w_11bd416
193a9dcd2.jpg,w_ec4b5d4 new_whale w_1f85037 w_73bfe11 w_d18083c
7b2ebae5b.jpg,w_81b2e1e new_whale w_b495218 w_d24c654 w_9d86594
ac3b2b031.jpg,w_0ad0f5b new_whale w_0531ad5 w_a9304b9 w_2330989
3ea72d441.jpg,w_2f4be30 new_whale w_6cfa650 w_f765256 w_2211e6d
5b73f2f2b.jpg,new_whale w_c2c1e28 w_f0fe284 w_4f3cebf w_1ca7433
ceaa82185.jpg,w_6fb7fe9 new_whale w_f19aeb4 w_36ceee6 w_7a97301
3d4cacabc.jpg,w_4846b27 new_whale w_4c614f3 w_39c246e w_e818b1a
7c0b26c45.jpg,w_db86325 new_whale w_3584852 w_f66ec54 w_082f603
a8ba54496.jpg,w_853aa18 new_whale w_83869d3 w_a41147a w_753d66c
71cfdf860.jpg,w_1133530 new_whale w_a6a732d w_eba33fb w_c1efffb
6ceba986d.jpg,w_e2372d6 new_whale w_0e2b483 w_c2c1e28 w_a34d26b
a82ba2f76.jpg,w_89f6097 new_whale w_714f89f w_f10aaf0 w_25d662d
4525f3d5b.jpg,new_whale w_7d46ac3 w_d22e12a w_3a241cf w_0d4a14b
a9be4d9dc.jpg,new_whale w_d12e2eb w_b53bfb7 w_13c715a w_b3197c6
1711cc58a.jpg,w_e27bbf6 new_whale w_759b919 w_488865e w_857cb95
a6101f30c.jpg,w_ea05006 new_whale w_c5bb7bb w_8620eca w_78351ee
afcc2fd2b.jpg,w_f87bc93 new_whale w_e145c7a w_428f3c0 w_d6aa3f3
7129f2495.jpg,w_c875e45 new_whale w_db3cfa4 w_67a9841 w_88e4537
6c762bc2a.jpg,new_whale w_9544084 w_bd1c3d5 w_d0589c5 w_c62ac72
3617bc78f.jpg,new_whale w_181ab06 w_2f67f0a w_30b577d w_a923a6c
a1130fbb5.jpg,w_3214120 new_whale w_0135f5f w_e01ca20 w_e966f36
d93c63dbe.jpg,w_71dfca3 new_whale w_3b15259 w_1b6f30f w_141a880
f3f3cffca.jpg,w_1887b5a new_whale w_5a0ef9f w_2f8eda5 w_31154fa
58302c1d8.jpg,new_whale w_45df6b0 w_2f1488c w_d4bc4ff w_95c7a6f
4fa2b0dc1.jpg,w_e8c5ff0 new_whale w_0fb38fe w_f0cf3f6 w_bb9306c
bfe8b6c2b.jpg,w_8a35001 new_whale w_56e52fb w_799b208 w_935a516
9ac1f4349.jpg,w_7f1f285 new_whale w_927dcdc w_9de2647 w_9f9f220
9870f00c2.jpg,w_38c6a8d new_whale w_90abfeb w_6189444 w_297503e
ff20c58cd.jpg,w_8ae65ef new_whale w_6cf6bf4 w_c88caf7 w_a6a732d
4368ed8a7.jpg,w_1a70f3a new_whale w_cfa9fb2 w_f6c5343 w_be5ee58
c0381fc3a.jpg,w_b4fe6b0 new_whale w_77c86af w_03a82c1 w_65a1bfa
756caf61e.jpg,w_a9304b9 new_whale w_a88f2c1 w_21b3c7e w_47996c6
3dcac20f1.jpg,new_whale w_8a1786f w_c7a611a w_9227ca2 w_a283c8c
97000a97c.jpg,w_b23555d new_whale w_5c083e6 w_15b5df2 w_6df47c6
a3ca6271b.jpg,w_6301785 new_whale w_a059841 w_3ff114c w_30f2f0f
e3316bbb4.jpg,w_3a4789b w_eec4e46 new_whale w_d4999d4 w_7b05eeb
639b733e4.jpg,w_1bbc982 new_whale w_e8c5ff0 w_3499014 w_83b2336
7df2168b2.jpg,w_b9ee9d1 new_whale w_c2a1bc4 w_fd906cc w_1029215
86a365247.jpg,w_ae83866 new_whale w_4857351 w_0a619af w_c6b4d61
6b2bb23f2.jpg,w_54ea24d new_whale w_ab629bb w_177d88e w_0b9cab4
4c61badb7.jpg,w_afb4a42 new_whale w_a371235 w_5cf0e37 w_9bebed8
3b6279c3d.jpg,w_d7998d1 new_whale w_c536a4a w_5910d78 w_0e325b0
3407fdfb6.jpg,w_bb9306c new_whale w_bacd6f4 w_6ed6320 w_9d86594
85ff27c6b.jpg,w_f64d347 new_whale w_68d1fb0 w_0a155b9 w_4130233
921022ceb.jpg,w_2e21094 new_whale w_d4661be w_8ca7f37 w_8f0c6ed
5af2d6181.jpg,w_1257748 new_whale w_d24ae04 w_daf857f w_01f14e1
e316c1266.jpg,w_520731e new_whale w_17b0d3a w_5f5f9ae w_cbcb5ed
b4bae8f4c.jpg,new_whale w_2fec5ea w_b3b887d w_c5a7b38 w_1286f9e
9944027d4.jpg,new_whale w_86918b8 w_ad88c85 w_705e466 w_b805777
a959b4482.jpg,w_12e7c23 new_whale w_1930599 w_4bf625b w_0f5d895
701b49c2b.jpg,w_fa887d3 new_whale w_08010cc w_13edc47 w_b7d68af
d4162ccc2.jpg,w_ae53e45 new_whale w_1457f13 w_350a5ba w_21b3c7e
e9bed6dd8.jpg,w_9b99992 new_whale w_e54d8f6 w_4135cb8 w_a26cf66
2a3812290.jpg,new_whale w_eb31833 w_662c89b w_de8def8 w_bfbf205
52654f3e9.jpg,w_5d9f814 new_whale w_102821e w_3d7dbf1 w_d5c0064
7f27a7d4e.jpg,w_e54d8f6 new_whale w_15e7de5 w_8d4c9f7 w_efa6b4a
367b03954.jpg,w_e27bbf6 new_whale w_857cb95 w_2644b11 w_fa955f1
6024fb077.jpg,w_685b8e1 new_whale w_3a2686e w_0bc078c w_69edff7
f34be206d.jpg,w_f602022 new_whale w_f74a89e w_792ffd7 w_db1f3de
9b958741a.jpg,w_a2f8488 new_whale w_e1c5b57 w_bd1c3d5 w_abc82c3
315de5250.jpg,w_f7234f1 w_2f8de4f new_whale w_d0589c5 w_ca66b79
8a896e584.jpg,w_57aeea3 new_whale w_b5cf062 w_ab44ae4 w_b79abd4
ac5073daa.jpg,w_fe881f2 new_whale w_030c8b0 w_ae393cd w_46796cc
8ae279dbb.jpg,w_0abe9e7 new_whale w_99d1f45 w_bace126 w_0b398b2
5deee355e.jpg,w_8103832 new_whale w_3de579a w_9583b7e w_96b94d5
d2b3f795d.jpg,w_510f3ee new_whale w_d8de44c w_ea2d2f9 w_4b815d3
fa30620d6.jpg,new_whale w_fdcaaa8 w_df6b050 w_45e98c0 w_728c615
000e7c7df.jpg,w_94c3bf0 new_whale w_4c07458 w_85923bb w_0bfc890
d9ce71098.jpg,w_27597ff new_whale w_f497e3f w_db0c7fd w_b1a3345
479536cbc.jpg,new_whale w_aa2d6fc w_c4c380f w_0af3867 w_480d478
466d6f7e6.jpg,w_03270e3 new_whale w_edf43c1 w_cb593df w_b7e3a9f
f9aaf6142.jpg,w_555e037 new_whale w_8eec034 w_accb0cb w_857cb95
cda5cebb0.jpg,w_ed1df50 new_whale w_f035513 w_0e7aae1 w_801eb08
887ef0fd0.jpg,w_3250a08 new_whale w_7e74b4e w_ac51301 w_d6aa3f3
bccd961af.jpg,w_5c028f2 new_whale w_c2372df w_4f44a61 w_dea40e2
9a50ec45b.jpg,w_23a388d new_whale w_7d8c37c w_c63fd83 w_b0f07c7
33ea4b366.jpg,w_5ac8fc1 new_whale w_98a5e5e w_c5bb7bb w_b870e44
8266c1af5.jpg,new_whale w_e53ba4a w_3b15259 w_0f25e3c w_65e0628
f3f1262ed.jpg,w_f94fc92 w_228c7ee new_whale w_414d441 w_42e0e40
6393509b9.jpg,w_44fe688 new_whale w_c55519c w_787af6b w_4b609e1
105e33e2f.jpg,new_whale w_f66ec54 w_2a7c1af w_ace2814 w_197979e
4e690846e.jpg,w_a616378 new_whale w_003bae6 w_1d830c2 w_20950a9
22ef3c6bd.jpg,w_214e081 new_whale w_95b6fde w_fb3959d w_560305a
2934148eb.jpg,w_a981164 new_whale w_cfeb24b w_fc6dd24 w_1faaf06
8df20308d.jpg,new_whale w_877de07 w_85d9e99 w_cee684e w_56af0a9
18fb5257c.jpg,w_da5b8fe new_whale w_88e4537 w_92cb6d9 w_63f5740
29b8c2b0a.jpg,new_whale w_09c8a69 w_f79ebf3 w_5d81be1 w_f20333d
fd584d62c.jpg,new_whale w_51e7506 w_9cff87c w_e090471 w_0af3867
246a3b660.jpg,w_b5d72cb new_whale w_ec77506 w_448e190 w_cef8ce0
0dd7d397c.jpg,w_6fe3566 w_a44a9b2 new_whale w_66168f1 w_789c969
dc8f729b0.jpg,w_a17b628 new_whale w_0c23936 w_689e1cd w_bff3c3b
4853537ad.jpg,w_b60e861 new_whale w_292956e w_7983f71 w_bc677de
c6635bf58.jpg,w_dea40e2 new_whale w_a41147a w_23a388d w_d976668
bf9c97eea.jpg,w_d6d2e4f new_whale w_a763725 w_df4b60a w_9a2b01d
516a177d9.jpg,w_8d0d921 new_whale w_1ca9ab1 w_242fb46 w_13ca7e8
10c99dcf9.jpg,w_0c7ab0d new_whale w_aa47677 w_c875e45 w_0a84ac5
79fa76173.jpg,new_whale w_243b654 w_89f6097 w_49afbc9 w_7709151
a34810714.jpg,w_76b8e6f new_whale w_9bd2794 w_2a7f00f w_fbf7d73
a8d01b4a8.jpg,new_whale w_ef83760 w_950c471 w_a94ea72 w_a3bb16b
638f57cf1.jpg,new_whale w_902f8b0 w_c6fe966 w_5f0af76 w_9490369
f1ff309e4.jpg,w_d351889 new_whale w_a16169d w_06d2e72 w_da011a1
8472b638b.jpg,w_53feb91 new_whale w_bfecb74 w_b6e4761 w_db38863
9d6218450.jpg,w_c5260b8 new_whale w_2284d86 w_e79fed4 w_3ae4d85
aa23a692e.jpg,w_9ed5f69 new_whale w_55b77ce w_4f717ba w_25f1a4e
c2b68dccc.jpg,w_53b6917 new_whale w_3c33b23 w_c49a22d w_a283c8c
c91fdfff3.jpg,w_a9a3878 new_whale w_a27f93b w_e36b021 w_eec4e46
7f80ef3f1.jpg,w_0655a0d w_108b2ed new_whale w_911384a w_e66ac81
a5d9762d1.jpg,w_d892cd9 new_whale w_20df2c5 w_0a619af w_9a1a810
c1b1eb7cf.jpg,w_f70c302 new_whale w_ddf876d w_97ba78a w_088cda7
a1985d472.jpg,w_7c23d73 new_whale w_27b7295 w_d6553ba w_af1d57b
0cf642c94.jpg,w_0f4d4ac new_whale w_4344f5e w_cf25b84 w_c82b49f
63a014924.jpg,w_ec7242a new_whale w_9be308e w_1d4e949 w_db30d65
9e8922834.jpg,w_a08f3cd new_whale w_6e85f95 w_3ff114c w_4135cb8
253f87df0.jpg,w_94a0d4e new_whale w_a7757d4 w_d980663 w_d3e323d
34d8ba7cb.jpg,w_a2f8488 new_whale w_c158581 w_91a2a20 w_a586dce
12be9222e.jpg,w_398323d new_whale w_3f8ff7c w_ddff916 w_45e0e10
f53df3fc7.jpg,w_6dce358 new_whale w_ef439a1 w_367fb60 w_6279534
743688ebb.jpg,new_whale w_d0bfef3 w_17b0d3a w_ebdc496 w_9748a78
bfb9ef767.jpg,w_6e77fd0 new_whale w_18934ab w_4eb6bcc w_1ebcda9
71cd9ea03.jpg,w_540ac0a new_whale w_f1ec429 w_7069d70 w_6310ac7
a2a020aaf.jpg,w_85baa9d new_whale w_64062df w_cac17d9 w_34ecf36
4f3907016.jpg,w_69c06ad new_whale w_43312c4 w_af9b524 w_27597ff
27bf0ce92.jpg,new_whale w_234713b w_9353e7c w_7aea0b8 w_b037216
cc2ac846d.jpg,w_b9e5911 new_whale w_ab7c369 w_9d86594 w_d05fc81
55bed5775.jpg,new_whale w_9b6d9b7 w_343f088 w_f9eb808 w_9a8c7dd
158d5273d.jpg,w_6840783 new_whale w_a6ef5a6 w_d7bfad6 w_1fc42e2
494e29ce6.jpg,new_whale w_94dcd2b w_4cc62b9 w_ec98537 w_ae6ac74
93d000dc9.jpg,w_3aa8e97 new_whale w_d980663 w_e906edd w_91b678a
513a0403c.jpg,w_609529a new_whale w_3643be7 w_5773c71 w_b860053
92790ce15.jpg,w_3c966be new_whale w_67153b4 w_ad343a6 w_d980663
3c17cd449.jpg,w_c1d2fbe new_whale w_f765256 w_00904a7 w_d588ecb
48344693a.jpg,w_d240f68 new_whale w_46ccc6f w_75ec7c1 w_bc65e7f
de9ed8aaa.jpg,w_022b708 w_d215a68 new_whale w_b7b1472 w_9fecf9d
edd13844e.jpg,w_f5a7f03 new_whale w_274397d w_fc230fd w_0d61101
c01e1d479.jpg,w_04738c8 new_whale w_0655608 w_9d59121 w_8b3a8b3
d54d38cd7.jpg,w_4adb4e9 new_whale w_510f3ee w_5c85850 w_7918564
590bbca9f.jpg,w_f765256 w_08630fd new_whale w_7e74b4e w_71a1a08
394a808c6.jpg,w_a780b2d new_whale w_db2d2ac w_c55519c w_b311fb6
55605d5e5.jpg,new_whale w_0189b6d w_6dce358 w_3518604 w_cbd5013
2711e0ba1.jpg,w_14f15a0 new_whale w_c49a22d w_c481650 w_08d62ee
26edcf428.jpg,w_7066887 new_whale w_7d06258 w_23d4815 w_00d5e98
372edc57a.jpg,w_5d81be1 new_whale w_eae8af4 w_dc642b6 w_88b2b19
b1df06725.jpg,new_whale w_f4980e2 w_13ae3d4 w_b5e6c9c w_a4fb1d8
7fa307935.jpg,w_4f717ba new_whale w_c6fe966 w_21666ad w_d875f4d
8a448bca0.jpg,new_whale w_21f1129 w_9037ac5 w_9c89384 w_787af6b
84dab8724.jpg,w_73b2fe3 new_whale w_af367c3 w_e36fb17 w_10f67bb
00512687e.jpg,new_whale w_62c78f3 w_5597026 w_be65810 w_bff3c3b
615384a6f.jpg,w_59052ad new_whale w_0bb71d3 w_63ea6fd w_698fcbe
0d6075348.jpg,w_716f64f new_whale w_4c07458 w_b86917d w_6fc8edc
0c533e95a.jpg,w_3c33b23 new_whale w_6f0cbe3 w_ad3a043 w_e966f36
a1fd18a61.jpg,w_20c0bc0 new_whale w_13aa123 w_1870783 w_953b7b2
b2b237c2d.jpg,w_1e85eea new_whale w_adedd1f w_55b77ce w_a046389
f60656113.jpg,w_5d5c6a6 new_whale w_9a91c1e w_94ea240 w_45c3ea2
4332a7705.jpg,w_733f661 new_whale w_ca11f46 w_6cb1ff1 w_e13f4e8
62e3a1d3d.jpg,new_whale w_b1c8a8b w_0d98e43 w_44c1eef w_16f4e1e
3e2d13f38.jpg,w_9236fb3 new_whale w_b89b6bf w_c566a3d w_ed0ee85
894db4115.jpg,w_15b3f09 new_whale w_4bd850b w_c797292 w_5d438a9
3ab1ebbfe.jpg,w_6612e89 new_whale w_4f717ba w_4fdff73 w_2b069ba
f0ebc84c6.jpg,new_whale w_f70c302 w_ef74616 w_bc285a6 w_c8d5ad5
13cff00e7.jpg,w_bcf69e9 new_whale w_6e0a45b w_7d458aa w_ac867fb
b9f5fd430.jpg,new_whale w_c5e1472 w_5f0fcab w_931b78f w_9b25161
b4ad5018d.jpg,w_c2a1bc4 w_b9ee9d1 new_whale w_9d59121 w_55ef07b
13f0fa9b9.jpg,w_b845c2b new_whale w_6caff0f w_3879fa0 w_f2e561e
8a3fe1e7e.jpg,w_555dcb4 new_whale w_8c0e550 w_394f053 w_9af432a
a3b8b1d8f.jpg,w_2964e0b new_whale w_b4b2b67 w_55e0064 w_41429ea
5f85ec4f6.jpg,w_5a2634c new_whale w_be776c7 w_9a9a2c8 w_99a26a3
e016fe339.jpg,new_whale w_daeba33 w_a86c082 w_30f2f0f w_e9910d5
3f85d2d9f.jpg,w_6172f4a new_whale w_5c4f274 w_91cc02c w_71d5ba2
682ddbb2f.jpg,w_6ae4956 new_whale w_eee74c2 w_180e241 w_9287505
64feaaa64.jpg,new_whale w_98d094e w_74c924a w_a1b7b83 w_ae8bd64
e1dedc6bd.jpg,new_whale w_c01b2e9 w_76b8e6f w_550ca18 w_b9373bc
e67b3fc69.jpg,w_1e3caae new_whale w_4b1a9b1 w_2745292 w_f408b56
e14b9e429.jpg,new_whale w_917cc49 w_5d06edd w_9a8c7dd w_05eb863
12ccd06a0.jpg,w_cde1082 new_whale w_b54f70f w_1d532b4 w_fbc7895
b56ec8cf1.jpg,w_23e1d57 new_whale w_954fec8 w_0ee7878 w_5ccee38
ef56a2701.jpg,w_ff65f67 new_whale w_71b9a85 w_911384a w_b420d45
78712aa9b.jpg,new_whale w_d9a3c6e w_c5e8495 w_8be0240 w_335bdd1
ab7218c29.jpg,w_9438119 new_whale w_455bc02 w_4b8638b w_9728637
2ec63abe5.jpg,w_cd4cb49 new_whale w_dd837b1 w_70a2a2f w_28c330c
8ab65822c.jpg,w_6c33987 new_whale w_2745292 w_3f5e8d7 w_e4d326a
77df417d8.jpg,w_6fe3dac new_whale w_e8b5980 w_ae19ff0 w_d1b3a00
618f8f91a.jpg,w_218fe4a new_whale w_5252dc7 w_7a91862 w_b475feb
03cbe2800.jpg,new_whale w_70d0b3c w_a05181b w_b5cf062 w_8a6a8d5
3b56f50a7.jpg,w_b200738 new_whale w_ceda389 w_c0c4587 w_8003858
072faed30.jpg,w_564a34b new_whale w_27b7295 w_f15f7be w_21ecbf3
8c6d90579.jpg,w_790fe92 new_whale w_0f0f15c w_6e0a45b w_b1e0959
925cc6cb9.jpg,w_5fbbce9 new_whale w_d22e12a w_030c8b0 w_c25d2d1
75199483a.jpg,w_11ce746 new_whale w_c7a8a7f w_4344f5e w_b38f64b
86934f4c8.jpg,w_8fa8bef new_whale w_9d56f22 w_45246db w_f2e561e
cc03494a1.jpg,new_whale w_c82dafb w_68aa903 w_a763725 w_298f605
02ab81ee7.jpg,w_b91bcd4 new_whale w_d18083c w_f6b8ccb w_150a6f5
31892c478.jpg,w_e3056e9 new_whale w_abba153 w_4cbf396 w_108b2ed
9e38c63b1.jpg,new_whale w_f87bc93 w_bef0a5d w_0f8b8e2 w_958b730
2c5de03aa.jpg,w_23bfd0a new_whale w_2e4cb98 w_972e51e w_1d830c2
efd46634d.jpg,w_91005b3 new_whale w_f812227 w_a915a6f w_12e8dc7
b54ed95e0.jpg,w_752ffa2 new_whale w_c69c9be w_d17d229 w_7e579dd
65b594cc6.jpg,w_02156b0 new_whale w_0e93f25 w_dba1c08 w_82e5785
1fd140eec.jpg,new_whale w_aee1ccf w_0cfdaa5 w_3f78360 w_a8ebc69
7396b1425.jpg,w_6cca536 new_whale w_bacd6f4 w_7c9f76d w_6c777a0
571f4975c.jpg,w_10bb1ba new_whale w_dd80742 w_97f4b38 w_5f20f03
5cf671e2c.jpg,w_8c25681 new_whale w_bc677de w_49cd60d w_6822dbc
c77f0395b.jpg,w_92c4ea5 new_whale w_2cabd62 w_c59d4b1 w_e014c37
8d4bb8274.jpg,new_whale w_068baa8 w_3128adb w_d8a47de w_6dbfd7a
3a1c525eb.jpg,w_705e466 new_whale w_f6e5311 w_d05fc81 w_5b8b487
a31c188b8.jpg,w_2e231f4 new_whale w_51b4749 w_07c946d w_f94039d
2a6bbd8c0.jpg,w_c1b34d2 new_whale w_0a4f5c9 w_ffe8693 w_11d8c70
ed05e28b2.jpg,w_772c726 new_whale w_0a155b9 w_8436e69 w_ba0751c
45108afa4.jpg,w_853aa18 new_whale w_c6c60c8 w_ddb514d w_4f3dc75
5345e8a17.jpg,w_11ec829 new_whale w_3263e72 w_9728637 w_d405854
b6d2eb464.jpg,w_6cb1882 new_whale w_e8b5980 w_24c76d8 w_72f3685
45a3099d3.jpg,new_whale w_c650f39 w_d875f4d w_a586dce w_17f5d1d
fde300d62.jpg,w_365b7ad new_whale w_89948b1 w_914b110 w_e9b4719
135656197.jpg,w_776f336 new_whale w_c2677ee w_5871dfd w_0c7ab0d
7597979f7.jpg,w_ce67c4c new_whale w_98bac23 w_05b4b0c w_d05827c
b40cf45de.jpg,w_f8511e9 new_whale w_53276a1 w_0277a07 w_5fedd5f
f5a7984a7.jpg,w_ea902fb new_whale w_7cb0e92 w_9769f0b w_778e474
