Image,Id
c24d6174a.jpg,new_whale w_3d1f606 w_2df85e7 w_997cda5 w_7cd0b86
d9bfcc8d9.jpg,w_e568f47 new_whale w_d8cb231 w_dfbf100 w_df27de9
0590607d3.jpg,w_9b5109b new_whale w_a79a828 w_07cc9c2 w_59109e5
4fc3d49e2.jpg,w_55a34c7 new_whale w_05669fe w_a6df3a5 w_659bdb8
e96e501ca.jpg,new_whale w_f4980e2 w_f6eed29 w_13ae3d4 w_b5e6c9c
a5b49c2fc.jpg,w_c875e45 new_whale w_db3cfa4 w_9e591f3 w_f150d99
73990fe42.jpg,new_whale w_e6d46e4 w_025911c w_56fcc39 w_950c471
79061808e.jpg,new_whale w_815a843 w_8c25681 w_260ff2c w_8157927
8166d2cd3.jpg,w_2e29743 new_whale w_91dd720 w_7087c88 w_544128b
ed49febe8.jpg,w_b3e445e new_whale w_8cee3d3 w_7b06e7e w_b82bea9
e1a97d9db.jpg,w_382262b new_whale w_23a388d w_7c6e8f0 w_76065ea
34ab5d292.jpg,w_b71ac68 new_whale w_f449c3d w_1f7c696 w_213fb07
5b0b37f12.jpg,new_whale w_527a019 w_8d0a2a2 w_c1efffb w_78de8f7
4cdcac8a5.jpg,w_961b5c4 new_whale w_ab2f0eb w_d0bfef3 w_5fedd5f
3b79c2285.jpg,w_d72771c new_whale w_48872ad w_bb2c919 w_740c748
ee693adea.jpg,w_315c854 w_d1f35d6 new_whale w_c7e1b12 w_b2606f3
ed2df9ba6.jpg,w_bd488f9 new_whale w_be1dbc1 w_1788910 w_2f5652a
54c29985c.jpg,w_712b916 new_whale w_26f7c39 w_8f0c6ed w_d31f7e6
01e1319b8.jpg,w_11ff425 new_whale w_208db25 w_540d5db w_6d8fad3
2dd067330.jpg,w_60ce6fc new_whale w_fe03daf w_f86b16b w_1788910
a44e66bb7.jpg,new_whale w_900c68f w_acf8fd1 w_5c028f2 w_82fac51
337d56059.jpg,w_5ad1ac9 new_whale w_3bf887a w_efbdcbc w_a26cf66
dca8b694c.jpg,w_f74a89e new_whale w_fbc7895 w_2f350be w_9387099
2546a4873.jpg,new_whale w_a10e633 w_010f858 w_88065f2 w_7e9df91
b1c2654bd.jpg,w_7432816 new_whale w_cc1784d w_ab2ac77 w_4ac8e76
f47b6fd38.jpg,w_4554dcd new_whale w_ae19ff0 w_1788910 w_75fc10c
12d84a07c.jpg,w_c5afe0e new_whale w_6c995fd w_04f5a19 w_cf1551f
445f42f79.jpg,new_whale w_64055b4 w_d5d111d w_dccbb2e w_b9131da
7cc978492.jpg,w_1f85037 new_whale w_7a427f2 w_6db266a w_944ac4f
404206f77.jpg,w_5796069 new_whale w_88e4537 w_7aea0b8 w_1f62b56
54afd9ed3.jpg,new_whale w_be4f189 w_33696ac w_f43d7eb w_8dc6c05
c2caaffd9.jpg,new_whale w_022b708 w_263bd97 w_d215a68 w_e08506c
9bef7c2b5.jpg,new_whale w_14ece76 w_972e51e w_32da935 w_90e9447
bc6259f19.jpg,w_1cfebce new_whale w_cfcace7 w_e64cf9a w_d869993
f75e3e7c9.jpg,new_whale w_e4a9205 w_016f0ea w_a84be0c w_6ebfe7b
e8f50d0cc.jpg,new_whale w_8e174c4 w_cdc4a40 w_b44e89d w_fc10c15
075310467.jpg,w_6e0a45b new_whale w_dae7ff7 w_6d8f72e w_9bd2794
9cb65bc63.jpg,w_d4c30a9 w_5597026 new_whale w_03ad89c w_50260e7
2bd8ce24f.jpg,new_whale w_b128587 w_23a388d w_92f4498 w_82ba482
e07da7876.jpg,w_73b2fe3 new_whale w_10f67bb w_90fb95b w_2f4be30
af25bbfb5.jpg,new_whale w_e2d8b09 w_ec4b5d4 w_1f85037 w_2f5652a
f4fbd3e1f.jpg,w_c684a38 new_whale w_88eaa39 w_3250a08 w_1f78a1e
d6665ce3d.jpg,new_whale w_2af46a8 w_9ddb645 w_bfcad53 w_2f74ff3
2043794e5.jpg,w_f9707a7 new_whale w_551165a w_76d1f84 w_85d9229
78788920e.jpg,w_4c07458 new_whale w_04d1c8c w_bf2b915 w_6e76427
ed8a15a97.jpg,w_51e91cb new_whale w_9f13096 w_38de45d w_fe87282
d7329a8f3.jpg,w_e8e08e6 new_whale w_3511bc7 w_ae924d9 w_e05c1a2
776a24bd5.jpg,w_9c68fe8 new_whale w_3f5c708 w_0a155b9 w_c17a2d4
c7403b488.jpg,w_4bf625b new_whale w_f0fe284 w_deb9471 w_8af65ed
55cb7488f.jpg,w_83a4279 new_whale w_857cb95 w_8cbe62a w_f94d9bb
22c0d7535.jpg,w_cf8ce56 w_7aea0b8 new_whale w_9c89384 w_2af46a8
467c10faf.jpg,w_18a06fd new_whale w_eeea781 w_3499014 w_d3734df
3b8e16e13.jpg,w_6cda039 new_whale w_9119b08 w_1b0c4b7 w_44479bb
28c38e199.jpg,new_whale w_c2397a4 w_d3e9662 w_dc642b6 w_e8b82f6
5f23e1d5d.jpg,new_whale w_510f3ee w_c875e45 w_49ae16f w_d44dfdc
6770d0d2c.jpg,new_whale w_a8276b4 w_5645ed1 w_d05fc81 w_f459442
441349700.jpg,w_91f13fe new_whale w_f864358 w_71670b3 w_80f481f
d16534644.jpg,new_whale w_df5bf3d w_50fd107 w_1d1fffe w_668c588
968bea008.jpg,w_bf46204 new_whale w_99e4fe2 w_8fb247e w_d48dfda
660049e53.jpg,w_45c5396 new_whale w_f0eddab w_c380132 w_3ebfe7a
dee7fd598.jpg,w_f527bd3 new_whale w_d210085 w_c6c60c8 w_80acb6f
365de2961.jpg,new_whale w_e19c1d6 w_c1efffb w_d7ef410 w_db602dc
39dc1342b.jpg,new_whale w_dee1053 w_a6ef5a6 w_39b9efe w_51e7506
f4bb70495.jpg,w_8bcc197 new_whale w_16b7fec w_07019f4 w_ae19ff0
0e2f8d45b.jpg,new_whale w_23a388d w_5773c71 w_23ce00e w_919f33b
706c53f2e.jpg,w_b1e0959 new_whale w_8d9d59a w_2a2bcf1 w_b128587
8392ed906.jpg,w_1fe6c6e new_whale w_e99e430 w_3b71107 w_cbeade6
4bd973b48.jpg,new_whale w_05d65b9 w_e9cf335 w_0e7ec27 w_1e286e0
b17d1f323.jpg,w_b3cc7b3 w_9bde64d new_whale w_ea902fb w_857cb95
009dd6c96.jpg,w_61b9586 new_whale w_803ad0d w_fd3a3f0 w_26c0ffd
417537581.jpg,new_whale w_b38d36d w_e0d3a78 w_de1dc14 w_ea91c50
bdd944df5.jpg,w_bb086fc new_whale w_ac33bfe w_0823d50 w_5d2dac8
70bf3f148.jpg,w_edf43c1 new_whale w_f75ed58 w_03270e3 w_298a035
6142ee067.jpg,w_124a3cb new_whale w_ae09e99 w_98a5e5e w_dfb57cc
c3077f299.jpg,new_whale w_9a9a2c8 w_af367c3 w_dc642b6 w_ea6a7fe
562b18d04.jpg,w_a63cd8d new_whale w_eb13108 w_394f053 w_9e591f3
bb081653b.jpg,w_e129173 new_whale w_1d532b4 w_b54f70f w_7fe4082
3f9168754.jpg,new_whale w_84c23bb w_ab44ae4 w_015a4bf w_0a8e080
d2d8ce174.jpg,w_4c206e7 new_whale w_a6703dd w_268addf w_be776c7
900abb919.jpg,new_whale w_bb7d9d5 w_91b678a w_2148753 w_4a8a4c9
afb2aef22.jpg,new_whale w_ca7089b w_753d66c w_7a91862 w_a41147a
27ec493c2.jpg,w_ba3c7af new_whale w_aa0dacc w_34ecf36 w_dc94d80
e33d25206.jpg,new_whale w_e966f36 w_ab2ac77 w_0135f5f w_0ee7878
7a6042cfe.jpg,w_06313c8 new_whale w_191bce3 w_08c7d09 w_44c1eef
a9b586996.jpg,w_4801beb new_whale w_9fe60cd w_e9e413e w_eb31833
86763556c.jpg,new_whale w_eae91de w_343f088 w_b3197c6 w_fdceb44
5a03ef706.jpg,w_a6703dd new_whale w_bf960fa w_c2de607 w_8a235b6
d0168508f.jpg,w_7e38d10 new_whale w_c38eb22 w_fccccec w_ad880b8
a91b3746a.jpg,w_0f466a5 new_whale w_6b47687 w_edf43c1 w_bf7c89a
a8c4fb957.jpg,w_28f572d new_whale w_46e198f w_01f14e1 w_84343d7
201f0f356.jpg,w_759b919 w_488865e new_whale w_c262606 w_e27bbf6
0a0ec5a23.jpg,w_fb3959d new_whale w_8799716 w_31d1d50 w_f035513
45b6a301d.jpg,new_whale w_2ab34d0 w_51b4749 w_0adb403 w_19f507e
3337e3aa3.jpg,w_112d2f8 new_whale w_c734fa4 w_46ccc6f w_acd217a
72d77d558.jpg,w_dcb4b9a new_whale w_83e0076 w_f86b16b w_8fda8b2
adbe0e59b.jpg,w_27597ff new_whale w_f19aeb4 w_ba4f96c w_450878a
30fe30c54.jpg,w_7c26ef7 new_whale w_7c1435e w_39141fc w_b569e70
2971dde9f.jpg,w_2a7f00f new_whale w_76b8e6f w_9bd2794 w_7c1435e
1bfe04a81.jpg,w_72db52b new_whale w_bb56867 w_3511bc7 w_50c4067
386930f88.jpg,new_whale w_d90a890 w_9eb6492 w_5520ce2 w_7e56d66
26f42b551.jpg,w_939423d w_fbc7895 new_whale w_d9f8641 w_bace126
bb221f4c8.jpg,w_aa45520 new_whale w_e19c1d6 w_f94d9bb w_519416c
b122628ec.jpg,w_8d71480 new_whale w_2ae40f9 w_48a6027 w_16df050
3155a9415.jpg,w_e8aa833 new_whale w_c262606 w_0bc078c w_25d662d
1e0271224.jpg,w_16fa149 new_whale w_e07b79f w_4d61be5 w_4c218b5
817fdbcec.jpg,w_7860ed5 new_whale w_ddf876d w_5c2c1a1 w_d542101
8e0a9e74b.jpg,w_b26e855 new_whale w_38e4345 w_3ce8ffa w_3c254c1
90ec865a7.jpg,w_b012783 new_whale w_f459442 w_fbc7895 w_f94039d
de2321338.jpg,w_7d9d014 new_whale w_5e47cfb w_5cc8711 w_648b85e
cda98aa10.jpg,w_9438119 new_whale w_cd4cb49 w_6a1280c w_b20b425
c77c8b648.jpg,new_whale w_e1f57e7 w_343f088 w_cc1784d w_102e715
78dd7058a.jpg,w_1ca9ab1 new_whale w_76e67dc w_adedd1f w_e966f36
25016ce54.jpg,w_6b3b848 new_whale w_d3b6c6b w_b48ce14 w_477f7b1
d7ac31c66.jpg,w_cf5335b new_whale w_01d790e w_8cee3d3 w_ae6ac74
e0a35c9fe.jpg,new_whale w_da2cf74 w_4a8a4c9 w_1da93f8 w_b35b19d
8d3a575f5.jpg,w_d0bf381 new_whale w_91037a7 w_6579856 w_a8a52de
583cd1fa4.jpg,new_whale w_1217536 w_e09baaa w_1be76f5 w_c6d4cb6
7ea2be99e.jpg,new_whale w_6c4a986 w_e4b4611 w_91b4760 w_70d0b3c
649a455a4.jpg,w_e966f36 new_whale w_4b5ade3 w_0ad1734 w_003bae6
d11ed8266.jpg,w_f765256 new_whale w_08630fd w_fbc7895 w_71a1a08
945f83889.jpg,w_36bbd71 new_whale w_58bc953 w_191bce3 w_0fdde23
5834ccaa0.jpg,new_whale w_71a1a08 w_d6aa3f3 w_e966f36 w_6e97efe
6a6534dee.jpg,w_85c5adf new_whale w_16fa149 w_193bf22 w_5c6bd71
704bf1bbb.jpg,w_e0cf908 new_whale w_b39aff5 w_733e9cc w_a059841
d30593f94.jpg,w_382262b new_whale w_7c6e8f0 w_23a388d w_28f572d
5cf2b3c01.jpg,w_a923a6c new_whale w_fccac74 w_96b94d5 w_3da0eae
824eddb77.jpg,w_f459442 new_whale w_88e4537 w_6ad771b w_83e8a3e
4e6889b39.jpg,w_db1b545 new_whale w_f437f82 w_0470377 w_f0eddab
5890c23be.jpg,w_6b2a111 new_whale w_fe59266 w_9e3859e w_8d09425
0547fccaa.jpg,w_5665c80 new_whale w_48619b3 w_7e2eb3d w_09c737d
a608e2cbc.jpg,w_d066c0a new_whale w_d87f911 w_f128a4d w_b4cf4b1
5facc67f9.jpg,new_whale w_0a6c4c7 w_d24c654 w_e885d82 w_1fb652d
9e847b626.jpg,new_whale w_73b2fe3 w_c6fe966 w_8b03a7f w_f00c99d
37b758383.jpg,w_d066f46 new_whale w_43d4a64 w_872f131 w_49afbc9
189fbe35c.jpg,w_01e1b97 new_whale w_3ad0f37 w_eaf9662 w_c5b80f9
b53320a56.jpg,new_whale w_bc285a6 w_db602dc w_a11932d w_c8bbb43
02283cf37.jpg,new_whale w_36bbd71 w_e740b27 w_69c8945 w_950c471
b3d234cfb.jpg,new_whale w_41a2f20 w_17b0d3a w_35756a2 w_9748a78
c8d40456e.jpg,w_480d478 new_whale w_c1efffb w_7d02551 w_6e97ef4
3f1987163.jpg,w_726c717 new_whale w_c3d896a w_f0fe284 w_1d9592f
9bcb5006f.jpg,new_whale w_3278209 w_72aa314 w_d44dfdc w_7918564
09f3b8b7f.jpg,w_b4b2b67 new_whale w_692734c w_97d60b9 w_fc6f897
79d688a96.jpg,w_b035775 w_808d40b new_whale w_ea6a9f4 w_d007a72
0dd64a6b3.jpg,w_022b708 new_whale w_c92d4a9 w_01cbbbd w_b7b1472
b497f1d6b.jpg,w_22a168a new_whale w_2c94198 w_84343d7 w_5bd26de
ba8c64486.jpg,w_cee684e w_3c8f7da new_whale w_32da935 w_fd3e556
ad3afe7cb.jpg,new_whale w_0f86e70 w_a8fa5f2 w_76a45de w_a88c767
d3130dc91.jpg,new_whale w_e0cf908 w_1d830c2 w_6e97ef4 w_dea40e2
63f24cb25.jpg,w_3ebfe7a new_whale w_13c1b55 w_59052ad w_96c35cc
2adc34521.jpg,new_whale w_b570fe1 w_13c9a17 w_6d80008 w_1b4b202
7062eba3d.jpg,w_d6aa3f3 new_whale w_d588ecb w_e4a9205 w_7150989
7bf5558de.jpg,w_789c969 w_f0fe284 new_whale w_d5e0aba w_e5978cf
f5ed1886a.jpg,new_whale w_609529a w_13c9277 w_3b15259 w_febd4fe
16f390578.jpg,w_3137898 new_whale w_cda3971 w_f64d347 w_f7d8d22
7669f81d8.jpg,w_f787e93 new_whale w_75d4e65 w_3bdf2c6 w_1e85eea
8c2bd28a2.jpg,new_whale w_7c1435e w_a5c74f4 w_8e3a722 w_2284d86
60c9a3a3e.jpg,new_whale w_7a427f2 w_c8901c6 w_143ea92 w_398323d
0f522e535.jpg,w_ed2b6f5 new_whale w_62db660 w_835a1eb w_59052ad
ebbc857bf.jpg,new_whale w_dc27ce9 w_cc9dfb5 w_8436e69 w_ebe9709
c0cd9eeca.jpg,w_50f9d24 new_whale w_c3bed1a w_4c07458 w_de657c1
5232009a2.jpg,w_6cda039 new_whale w_9119b08 w_44479bb w_1b0c4b7
57a13373e.jpg,w_eced610 new_whale w_67153b4 w_a123aa1 w_b7ad0fb
7061e65bb.jpg,w_98f16af new_whale w_ad343a6 w_a37815c w_e5ad760
a289c4868.jpg,w_cb593df new_whale w_03270e3 w_551165a w_33fccbe
1626dbed7.jpg,new_whale w_1afed1e w_b9d732d w_6d8fad3 w_f082806
e0e9e89a6.jpg,new_whale w_063282e w_c0b01ea w_e8aa833 w_b524f96
f864e9e4f.jpg,w_d6553ba new_whale w_13edc47 w_ff5fc91 w_fd4376a
1b3bc3b0a.jpg,new_whale w_a190a88 w_d6283ba w_81691be w_70d0b3c
4bb651519.jpg,w_948268e new_whale w_df6b050 w_5cf0e37 w_f3addb7
bd5a817bc.jpg,w_e99ed06 new_whale w_066ac1a w_122e247 w_3b03149
ec6197775.jpg,w_db68456 new_whale w_9544084 w_ac90846 w_1e9caad
fc3345619.jpg,w_9b5109b new_whale w_1f41b98 w_a79a828 w_894296c
2945b5c01.jpg,w_7e56d66 new_whale w_6fe3dac w_274d994 w_d055e5f
3bdef26dd.jpg,w_5be4e45 new_whale w_5fbbce9 w_f50b00d w_059d9e0
dff259534.jpg,new_whale w_6aff5b1 w_ebdad2e w_5065c2b w_56e52fb
0a3f2415f.jpg,w_7488eec new_whale w_4d62749 w_4ede58b w_082978e
bb862c684.jpg,w_ccc26ea new_whale w_4ea4f59 w_fb4f74a w_decafbd
cb5c7131d.jpg,w_1ecca2d new_whale w_bfcad53 w_69c8945 w_21666ad
5c101d530.jpg,w_5101888 w_62fc862 new_whale w_40a6c9c w_dcbdd01
fbad45cd1.jpg,w_f6c5343 new_whale w_d0fd41c w_859dbc3 w_28218e1
ce5727299.jpg,w_ec4b5d4 new_whale w_9adf29b w_69c06ad w_bef54e9
70701da3e.jpg,new_whale w_ac51301 w_85222f9 w_8be8406 w_03270e3
cfe5b175e.jpg,new_whale w_d4b1766 w_81d807a w_d588fb4 w_700ebb4
05dfa0c72.jpg,new_whale w_881fca8 w_139d19a w_c562266 w_7d458aa
2a13045d1.jpg,new_whale w_716f64f w_1d2ed91 w_03670aa w_144ecb6
ec5c82152.jpg,w_6fe5b8e new_whale w_fd98539 w_beb062d w_f71100b
097ffdb27.jpg,w_78e7020 w_0cbf1b3 new_whale w_6f0cbe3 w_c684a38
e011697e2.jpg,w_0ce537a new_whale w_eaa5dbb w_e5978cf w_8675aac
11d369040.jpg,w_3643be7 new_whale w_0189b6d w_609529a w_0ecda0a
4649aac7c.jpg,w_d4bc4ff new_whale w_2f1488c w_c9b4607 w_45df6b0
2595349ea.jpg,w_9583b7e new_whale w_e0cf908 w_99b7ba2 w_8157927
d03f497ef.jpg,w_deedca6 new_whale w_454f511 w_05b4b0c w_53aa231
b62230f27.jpg,new_whale w_fb52b93 w_193bf22 w_c8d5ad5 w_91037a7
15002293b.jpg,w_564a34b new_whale w_27b7295 w_c6fe966 w_1da3327
85fa8ce46.jpg,w_b9d732d new_whale w_8d33cf5 w_9d59be4 w_0c59853
bd7e437f8.jpg,w_e52ff99 new_whale w_b55fb6e w_c17a2d4 w_fccac74
0238ebb55.jpg,w_4516ff1 new_whale w_ce4d993 w_6612e89 w_d8b5bb4
a9ec154aa.jpg,new_whale w_69ce621 w_a8b0ec1 w_ef83760 w_31154fa
585462a2f.jpg,w_78e6713 new_whale w_5530579 w_a13f1d0 w_57aeea3
11295be4d.jpg,w_29c88c2 new_whale w_f6b8ccb w_80f481f w_8da30ad
96e7743f0.jpg,w_a27f93b new_whale w_dfd0ae8 w_70e9661 w_5841fb9
35bab125f.jpg,new_whale w_122e247 w_88e4537 w_c073f96 w_f765256
2f25893c3.jpg,w_c82b49f new_whale w_a1e3bc9 w_888391a w_7c60e77
c2e9bca9b.jpg,w_d593be8 new_whale w_34053b9 w_778e474 w_3079e26
ff2b1bd37.jpg,w_55a34c7 new_whale w_9353e7c w_bd572cf w_a0534e5
73214396a.jpg,w_3a63e33 new_whale w_9544084 w_186d294 w_43d4a64
6ce0213bf.jpg,new_whale w_19410fe w_f602022 w_d8a47de w_789c969
2870648d0.jpg,w_4182dba new_whale w_6fe3dac w_719ee7e w_67153b4
524969f8f.jpg,w_fc6f897 new_whale w_d588fb4 w_b037216 w_56a96ed
b70ef8338.jpg,w_e6325d7 new_whale w_41429ea w_acba807 w_7fe4082
7d139e2fb.jpg,w_c1d2d7f new_whale w_102821e w_9713c92 w_85bb73c
ea9af2479.jpg,new_whale w_af1d57b w_a6a732d w_d593be8 w_3137deb
4d56f9a3e.jpg,new_whale w_ef83760 w_3d7dbf1 w_36bbd71 w_2b17316
31d1a1179.jpg,w_84d832d new_whale w_3ff114c w_9800d65 w_2059146
121392e9a.jpg,w_3283995 new_whale w_c481650 w_1b77e4f w_3de579a
62bc77637.jpg,new_whale w_1032fa3 w_72f3685 w_328e490 w_f6e5311
5bcd04fbe.jpg,w_391ef09 new_whale w_fd51859 w_55b77ce w_61ed07a
44a464f19.jpg,w_b2af5eb new_whale w_9573686 w_6d43e1d w_6fe3566
c38571be7.jpg,new_whale w_a8b34a0 w_36b8101 w_3b15259 w_a0265bd
d9c8f35f7.jpg,w_85d9e99 new_whale w_c69c9be w_5b227ec w_a2f8488
b61ac3567.jpg,w_9ef6147 new_whale w_7d458aa w_5101888 w_d9e7ed3
5831b4c8c.jpg,w_23e1d57 new_whale w_954fec8 w_5ccee38 w_80a59e6
82d8acaa0.jpg,w_b48ce14 w_f94039d new_whale w_6b3b848 w_4dcdda3
660f0590b.jpg,new_whale w_2e45865 w_06619ff w_5258623 w_dfbf100
1b5dcf04b.jpg,w_2f67f0a new_whale w_4df6c4b w_18ca0f1 w_6a1280c
11850b2ea.jpg,new_whale w_c1efffb w_0f25e6b w_879dcef w_8936c44
f5e227194.jpg,w_4bf625b new_whale w_f0fe284 w_fd9d727 w_56d38d8
c24dad592.jpg,w_fd6a3ad new_whale w_6071978 w_8f65356 w_5ea7acf
dd1afa250.jpg,w_15951db new_whale w_9cc2c36 w_2ac6611 w_276d61d
8fb23da6e.jpg,w_44803e4 new_whale w_bfcad53 w_5a2634c w_4ea4f59
6a0c72dc1.jpg,new_whale w_b877008 w_1b5fd1b w_88aca21 w_b2bc0c9
9839cf047.jpg,w_3a63e33 new_whale w_6d80008 w_9544084 w_335a58c
f9fdac10d.jpg,w_725bf15 new_whale w_b7b0ad7 w_ace2814 w_3815890
fd4f0bf67.jpg,new_whale w_0a2e1ef w_be6e58a w_2b1b04e w_9541441
0d185d2df.jpg,w_fd3e556 new_whale w_ca66b79 w_9e52d87 w_94a7669
98c8ef2d9.jpg,w_eacf402 new_whale w_9d56f22 w_1d532b4 w_f459442
ba297763d.jpg,new_whale w_08630fd w_7983f71 w_2b979e6 w_988e8ec
5c8cbb78d.jpg,new_whale w_43fc74c w_f201548 w_57db059 w_a6a732d
68158cf97.jpg,w_c7951e0 w_eaa5dbb new_whale w_da08395 w_17338da
4d4389e4f.jpg,new_whale w_3b03149 w_9236fb3 w_d72771c w_b7d68af
17e02f282.jpg,new_whale w_52a5d92 w_72c56cc w_729290b w_99a26a3
ca96b7e3b.jpg,w_ef83760 new_whale w_0cbf1b3 w_2b17316 w_7e2eb3d
9a72cea80.jpg,w_ec32fa6 new_whale w_9544084 w_f953704 w_c9b4607
2913a8fda.jpg,w_d9405b3 new_whale w_2e706fc w_c170c5d w_4e01dd9
81700fd54.jpg,w_1ca7433 new_whale w_6a1280c w_de1dc14 w_f0fe284
2c22f4477.jpg,w_f0fe284 new_whale w_4bf625b w_86fa148 w_6c0cdb1
db5471dd3.jpg,w_3e979c0 new_whale w_c0d11da w_da04408 w_232f528
ecc7d7209.jpg,w_46e59f5 new_whale w_1afed1e w_27a6304 w_cdb8e7f
404b52ee2.jpg,w_36bbd71 new_whale w_3a91b10 w_82ba482 w_fae4be5
4a3662cc5.jpg,w_f86b16b new_whale w_8fda8b2 w_c1d2fbe w_593949b
5160eae6b.jpg,w_1788910 new_whale w_cbd5013 w_f784bac w_e2e7384
ea4f48673.jpg,w_cf5335b new_whale w_26301f8 w_f0fe284 w_8cee3d3
5c2017473.jpg,w_c76f8f4 new_whale w_9a9a2c8 w_28c330c w_bd80cf2
eaf023401.jpg,w_dd88965 new_whale w_a92e68e w_ed29ffe w_abf0b13
1ab291651.jpg,w_68ae353 new_whale w_e3956f5 w_eec4e46 w_7cc2687
de99267b7.jpg,new_whale w_1995d15 w_0032a46 w_b3197c6 w_8bcc197
40315d42d.jpg,w_da3106e new_whale w_d875f4d w_2b069ba w_86220e0
23c60e8e8.jpg,new_whale w_5fbbce9 w_1b6f6dc w_571cf6d w_38de45d
156cd5898.jpg,w_ca1d5a8 new_whale w_ac2df91 w_7af5b09 w_691b684
234c4266d.jpg,w_b950c88 new_whale w_343f088 w_b4a7cd2 w_ae536d6
e7d685096.jpg,w_8c25681 w_6822dbc new_whale w_a8d89df w_b6e4761
91cb09be1.jpg,w_715ceba new_whale w_17b0d3a w_a491df7 w_66168f1
c03dedb0d.jpg,w_1419d90 new_whale w_97d60b9 w_c69c9be w_f5a7f03
7cf3137a7.jpg,w_f276da3 new_whale w_28a16b0 w_2b1b04e w_cfe7928
f12717842.jpg,w_e2372d6 new_whale w_518a722 w_0e2b483 w_a34d26b
bdd6b7481.jpg,w_107b98e new_whale w_76f95b1 w_92f64ee w_efcbb06
8e1d39e97.jpg,w_6279534 new_whale w_6525e6b w_e0a42ad w_420dafb
555fac134.jpg,new_whale w_c536a4a w_ea4a7db w_5485228 w_2b979e6
497a8fed2.jpg,w_8debfa9 new_whale w_fd98539 w_9d6c63d w_8e92662
7ea0f45a8.jpg,new_whale w_e5ad760 w_f11cbbc w_203042e w_88e4cbf
1920d2fa4.jpg,w_6684eea new_whale w_27597ff w_e966f36 w_5d1c9eb
58605935e.jpg,w_914b110 new_whale w_f314516 w_98cc97d w_0a3255c
cea968ab9.jpg,w_c1e1867 new_whale w_b9c99cc w_11bd416 w_0a31a3a
c507b7cae.jpg,w_b28898a new_whale w_7656c1a w_5645ed1 w_a10515b
b4f2aba3c.jpg,w_ece94e8 new_whale w_9438119 w_0a84ac5 w_523fb3a
759e2cfac.jpg,new_whale w_88bb921 w_102821e w_cfcace7 w_d64a9fa
197b703e4.jpg,w_da2cf74 new_whale w_6452aca w_d0bfef3 w_789c969
713b9a678.jpg,new_whale w_729290b w_ff7a4ae w_2b7f65a w_81da9a5
01fb8d6d7.jpg,new_whale w_e164857 w_b51a226 w_dec9108 w_8fad4d2
394b1130f.jpg,w_75fc10c new_whale w_5d36478 w_18c481a w_d16eb60
185014709.jpg,w_2d6bb89 new_whale w_f9aab0c w_0bc078c w_9cc2c36
f14e56577.jpg,w_3c4f583 new_whale w_a548534 w_0b10e7c w_87ed7a9
4c4c984e5.jpg,new_whale w_d0fd41c w_6545943 w_550ca18 w_881fca8
25fbd433a.jpg,new_whale w_bfcad53 w_242fb46 w_0e0b65c w_72ab123
8e10aac2d.jpg,w_114a297 new_whale w_cde1082 w_993320b w_15b5eb1
1173d784c.jpg,w_fe0c54f new_whale w_53d3f73 w_dfe2ab5 w_e0d3a78
6f96f8904.jpg,new_whale w_af493e1 w_ec4b5d4 w_c751a77 w_1d8d7c3
cd970d099.jpg,w_c0f1e04 new_whale w_5801869 w_b07ec5d w_1032fa3
06c46df18.jpg,w_f10aaf0 new_whale w_89f6097 w_871decc w_9490369
15db5e93d.jpg,w_903c254 w_685115a new_whale w_91b678a w_9a5bb2d
24c5b97bb.jpg,w_3fb99a3 new_whale w_47aa042 w_25e04d9 w_f3d2e31
bc766ae57.jpg,w_f6c5343 new_whale w_a0534e5 w_28218e1 w_96c6613
48ee3071b.jpg,w_d0bfef3 new_whale w_1220336 w_a17b628 w_9748a78
829108d61.jpg,new_whale w_9a1a810 w_c1d2d7f w_5cc8711 w_3fe5d56
ca133eec9.jpg,w_60f11fb new_whale w_52adbfa w_04d4568 w_7fcf284
5e8bcae50.jpg,w_6caa59f w_7547b9a new_whale w_6e0a45b w_ec77506
031819a74.jpg,new_whale w_96c35cc w_83eaf7e w_efaba3b w_c2873ef
a07e5d7ed.jpg,w_0655608 w_3eae264 new_whale w_2af46a8 w_9ed5f69
e6b21c6c5.jpg,w_ca93339 new_whale w_a5a0a57 w_9d86594 w_6e85f95
053951fbe.jpg,w_5f31117 new_whale w_0ee9ae5 w_ae8982d w_18a06fd
22fb63826.jpg,new_whale w_3137deb w_4cb61b2 w_efc0825 w_acba807
859f00285.jpg,w_1032bb6 new_whale w_836e895 w_b2341d4 w_c6b4d61
02a9c6f67.jpg,w_10a4e10 new_whale w_0d54c55 w_8e9f047 w_27a6304
aeef12206.jpg,w_c1b34d2 new_whale w_dcd9088 w_7f762d8 w_b9e5911
d13c0576b.jpg,w_ec32fa6 new_whale w_60cf87c w_9544084 w_93fddcb
707ce9cfb.jpg,w_596f6bc new_whale w_fd4376a w_9ba6731 w_38c5952
1fc48c1d1.jpg,w_b3cfa1d new_whale w_7b41bf7 w_1f1cee1 w_0135f5f
2808f986f.jpg,w_242fb46 new_whale w_75b6e81 w_a1756d9 w_3976c05
f11f85a38.jpg,new_whale w_6cb656d w_b0446cd w_5e5fec6 w_416168a
795b85789.jpg,w_b02ac52 new_whale w_c5ee28a w_c8bbb43 w_e65664f
f81464fab.jpg,w_1220336 new_whale w_d0bfef3 w_a17b628 w_8041789
b246ec122.jpg,w_789c969 new_whale w_f0fe284 w_e5978cf w_9a9a2c8
7d8496456.jpg,w_ecdef5e new_whale w_2a1a012 w_b51e6f6 w_6465d75
f937b553e.jpg,w_e19a641 new_whale w_aabdf8c w_3f5c708 w_34ecf36
16abbece8.jpg,w_3643be7 new_whale w_fd98539 w_263fcb0 w_394165d
264afc332.jpg,w_007fefa new_whale w_f314516 w_41d24c6 w_636aa5b
f3d9a6944.jpg,new_whale w_28c330c w_c80541e w_91dd720 w_4b66b5f
96d5f04a0.jpg,w_a548534 new_whale w_3c4f583 w_7b41bf7 w_1b4bb29
46a2611b1.jpg,w_f0a8b3e new_whale w_b397217 w_c85ff1e w_97ba78a
f0e054fc2.jpg,new_whale w_67153b4 w_fb52b93 w_09bd7e8 w_a190a88
1e683316e.jpg,w_bee8a00 new_whale w_ff5fc91 w_6c995fd w_de1dc14
141a3edc7.jpg,new_whale w_551f361 w_98a87a6 w_a053ed9 w_687c6d3
3f62ad59e.jpg,w_08d62ee new_whale w_9a9a2c8 w_1788910 w_c3e88ae
9ef6ee19d.jpg,w_d6fde02 new_whale w_dc56028 w_535448f w_4a12050
4c955a088.jpg,w_89948b1 new_whale w_365b7ad w_8f424c5 w_611d18b
2f4ec9a20.jpg,w_56ed74d new_whale w_490d198 w_4b815d3 w_21ae2d7
2c4d75bc2.jpg,w_0ee9ae5 new_whale w_df86a42 w_cac9bdb w_ec7f1b3
0ed1078f8.jpg,w_e6dfc39 new_whale w_685d7a7 w_40efb29 w_b0d1046
73ac151ce.jpg,w_66639d4 new_whale w_12aae3e w_67fa427 w_a3b1a48
178910d15.jpg,w_144ecb6 new_whale w_9fe60cd w_4e1e04d w_9b25161
b48f8d186.jpg,w_df27de9 new_whale w_b9c99cc w_5d67caa w_18f9d19
8995e32d7.jpg,w_56fcc39 new_whale w_cffd90e w_cefd512 w_025911c
db49c314a.jpg,w_d223b2e new_whale w_16b5050 w_b89b6bf w_551f361
b86ee5851.jpg,w_45473b9 new_whale w_e819d10 w_d12f2a0 w_60ce6fc
7861b6fce.jpg,new_whale w_e0b6a42 w_b79abd4 w_e3fb839 w_9748a78
29b021120.jpg,new_whale w_e818b1a w_afe2b56 w_066ddc5 w_a9304b9
8f7b64491.jpg,w_e9910d5 new_whale w_37d7c02 w_6fce84d w_52b60a6
94fedbc3f.jpg,new_whale w_9a1a810 w_c720f04 w_3b03149 w_92f4498
6bb969341.jpg,new_whale w_e1c796a w_98164c0 w_fb8e059 w_698fcbe
560ef41cd.jpg,w_0bc078c new_whale w_97ba78a w_6e7cf1c w_cc00be9
c7a00ca3c.jpg,w_8c25681 new_whale w_b8a7ee7 w_c190c60 w_7e5b9da
4740c8f33.jpg,w_ec4bcf9 new_whale w_9b46d56 w_eba33fb w_0b398b2
54c89ae1a.jpg,w_488865e w_759b919 new_whale w_f347577 w_e27bbf6
b75ce144d.jpg,w_69a58b2 new_whale w_ad88c85 w_30f2f0f w_1c6465a
80ccbd951.jpg,new_whale w_7b4ffdd w_3b15259 w_704a8a1 w_bc65e7f
bc577ba90.jpg,w_f1b016e w_6525e6b new_whale w_15e3099 w_6332313
c0ef727fb.jpg,w_c405fe4 new_whale w_446a02d w_9a1a810 w_6d8f72e
a6f29ca27.jpg,new_whale w_4ab3420 w_b7c9e1e w_b38f64b w_9eb2d2a
e89a7b2b5.jpg,new_whale w_4c07458 w_b1abd47 w_b101c26 w_1403973
33c49ea61.jpg,w_47aa042 new_whale w_ed29ffe w_83cc0ec w_bfe6992
5468fd163.jpg,new_whale w_d3e9662 w_3b970db w_52adbfa w_60f11fb
72f7dc59b.jpg,w_eb3f1ff new_whale w_fd6b0da w_fbc7895 w_be776c7
78399e1c4.jpg,w_65a1bfa new_whale w_b6e4761 w_b18df25 w_2c2e6b9
f6f2b4506.jpg,w_d3e5689 new_whale w_3962169 w_6a1280c w_3b15259
bde054dea.jpg,w_14330a0 new_whale w_1719d81 w_7d8b00d w_85b3564
48bfffc8e.jpg,new_whale w_06a10b4 w_c875e45 w_46ccc6f w_be5615a
afc638502.jpg,w_71ed685 new_whale w_620dffe w_e09baaa w_79a2659
11e0bcf3a.jpg,w_6bab2bd new_whale w_dea042e w_f082806 w_a046389
17c633024.jpg,w_a331c8b new_whale w_66dd189 w_497efb9 w_92f4498
0aa16aa26.jpg,w_16b5050 new_whale w_749dffd w_276d61d w_62c78f3
18f266c6a.jpg,new_whale w_0e0f074 w_19671ad w_550dd10 w_2c94198
ded487f6e.jpg,w_518a722 new_whale w_af9b524 w_10a4e10 w_4c07458
b0e1e0d35.jpg,w_2b069ba new_whale w_8003858 w_857cb95 w_8cbe62a
5e3c4b3f0.jpg,w_2e374c0 new_whale w_902f8b0 w_065ee1b w_6906eed
138daa77a.jpg,new_whale w_0655a0d w_0fefc62 w_08630fd w_edce644
0982ee2f3.jpg,w_65c24c3 new_whale w_2e4b740 w_9b89c88 w_444b771
6f73c4acd.jpg,w_dc76f1c new_whale w_2b4b82e w_63ea6fd w_65a1bfa
e48c9699b.jpg,w_d5bbfbc new_whale w_2b47174 w_8af65ed w_28218e1
4754bacc1.jpg,w_ab2f0eb new_whale w_25d7e08 w_a47dc2d w_bdea26c
68d17a8be.jpg,w_01f14e1 new_whale w_7c6e8f0 w_9ad3618 w_1257748
c1e7d19e3.jpg,w_53276a1 new_whale w_b9c99cc w_099bcbc w_f8511e9
c6bbca287.jpg,new_whale w_f812227 w_71f5c74 w_b4cf4b1 w_d962e2b
39bba7418.jpg,w_9d5968b new_whale w_2b17316 w_32838db w_772c726
b7a82d57c.jpg,w_0f5666b new_whale w_a009604 w_3ff114c w_d909f72
ff510bb4a.jpg,new_whale w_494c72d w_c1efffb w_0bf90d9 w_00a41ba
1b0d4c9c2.jpg,w_fdc6e6d new_whale w_9697236 w_625e590 w_efe3a39
4120b46d6.jpg,new_whale w_5612025 w_438dd0b w_234713b w_cde1082
fc7cf099e.jpg,w_9032a74 new_whale w_abd9d0b w_b57a7be w_a053e56
dbc59a6fa.jpg,new_whale w_db602dc w_3584852 w_ef29036 w_5966e55
98d56e3e4.jpg,w_52db74a new_whale w_686bbcb w_e906edd w_1daae48
235874ed0.jpg,new_whale w_1995d15 w_5be4e45 w_94e136e w_b919d77
3b29e4b8c.jpg,new_whale w_c073f96 w_8d33cf5 w_140a9ac w_44a6509
9c1153dfb.jpg,new_whale w_51e7506 w_297503e w_38c6a8d w_4362671
f180bad6a.jpg,w_9b69214 new_whale w_63b91aa w_7087c88 w_5d9f814
d4b40e028.jpg,w_2f702db new_whale w_38c8a8d w_0aed03f w_eba33fb
6f1bedf11.jpg,w_dcbdd01 w_8be0240 new_whale w_c5e8495 w_5a2634c
016bbca6e.jpg,w_c720f04 new_whale w_be2ce29 w_c1d2d7f w_f150d99
1c0be8135.jpg,w_fa2ec89 new_whale w_53d3f73 w_274397d w_0135f5f
dead20577.jpg,w_8ea9f68 new_whale w_443afc0 w_ad7b758 w_f971ecb
908b0b060.jpg,new_whale w_8d0a2a2 w_07cb113 w_6ebed02 w_9da1811
a2241c9e5.jpg,w_df1cc01 new_whale w_1c55cc3 w_2117e10 w_37e08ff
9efbc264f.jpg,w_90a2cf7 new_whale w_72ab123 w_584e1dc w_21666ad
3a3598815.jpg,w_c8d5ad5 new_whale w_984bb5c w_d786f52 w_d77337e
32ce7b6cb.jpg,w_accb0cb new_whale w_2f350be w_4fadedd w_27b7295
86a174149.jpg,new_whale w_18aafe8 w_efa895a w_8cce8ce w_a88f2c1
6418f3699.jpg,w_df487e8 w_9d86594 new_whale w_6e97ef4 w_2964e0b
02475f335.jpg,w_9c506f6 new_whale w_27597ff w_05cc23c w_60a54be
05102ebd0.jpg,new_whale w_03ad89c w_a34d26b w_a32ff7f w_e3956f5
4677897ba.jpg,w_db1b545 new_whale w_0470377 w_8f0c6ed w_f0eddab
ae0f743e6.jpg,w_972e7db new_whale w_e533679 w_ec7e60a w_a68bac6
b03c3ae08.jpg,w_4024b54 new_whale w_aee06ab w_e4a9205 w_1c6465a
7b217f3fa.jpg,w_91b96c1 new_whale w_2f79ae3 w_57aeea3 w_e07b79f
28a6540ea.jpg,w_9bd2794 new_whale w_76b8e6f w_fbf7d73 w_94c3bf0
03bdbf2a6.jpg,w_0833a92 new_whale w_26c0ffd w_5b262f1 w_511b9b5
dcf41e5ea.jpg,new_whale w_e01be7a w_4e1e04d w_e0f635c w_0f25e3c
ab6dd1c8c.jpg,w_4776fc5 new_whale w_04003e9 w_778e474 w_b28898a
