Image,Id
8c82ba1d5.jpg,w_47d86e8 new_whale w_7e56d66 w_4ff2f4a w_f773fbe
cae232b72.jpg,new_whale w_1995d15 w_9ad3618 w_5045d2c w_4f3cebf
8a63e77b5.jpg,new_whale w_e99ed06 w_46ccc6f w_8e92662 w_22f2567
973c6b0b6.jpg,new_whale w_18934ab w_0a619af w_4ab3420 w_50155e6
97398069c.jpg,w_5d6ba39 new_whale w_9b171a8 w_02469a1 w_ef83760
a30eed8c8.jpg,w_0d5fa2c w_ecb61a0 new_whale w_27597ff w_db0c7fd
c9804c02f.jpg,w_67a9841 new_whale w_efc0825 w_fdc6e6d w_c1efffb
36282f9b8.jpg,w_b72dc3d new_whale w_8d52508 w_c734fa4 w_6b1bd76
20a646243.jpg,w_7cb0e92 new_whale w_4312b77 w_759b919 w_1f6de0b
cc9183037.jpg,w_1ff410a new_whale w_bf41c21 w_4fdff73 w_68ef337
906b3c9c3.jpg,w_9ddb645 new_whale w_fdc6e6d w_d603939 w_43fa7fc
bfd521ee0.jpg,new_whale w_586abcf w_b66e1a5 w_aa2d6fc w_1029215
6b9a2e03e.jpg,w_0369a5c new_whale w_e6450bc w_c7e2a65 w_8ea0c7d
0219364ca.jpg,w_9ca67be new_whale w_ed5c855 w_ae32f8b w_fccccec
7cc4522cc.jpg,w_e3c4772 new_whale w_ba62b79 w_df34804 w_58d8bbd
5cec206ff.jpg,w_0d43823 new_whale w_c9cf75d w_5010896 w_535448f
7cc19a435.jpg,w_742f7f5 new_whale w_faf5287 w_0b7ce1e w_2a6d5ee
2637f5914.jpg,w_ee9db93 new_whale w_1574bd1 w_16def42 w_ae53e45
0d3603904.jpg,w_16b5050 new_whale w_749dffd w_276d61d w_8fd3810
4cf8b7c49.jpg,w_2211e6d new_whale w_c6fe966 w_73d71d2 w_0ac1b5f
a3bfd8451.jpg,w_b311fb6 new_whale w_db0c7fd w_0d5fa2c w_32b01d7
602311d6f.jpg,new_whale w_9c68fe8 w_e726a9c w_0abe9e7 w_df1cc01
fc097db3a.jpg,w_8c28a3c new_whale w_bafa095 w_eced610 w_2858e46
ef741b3d5.jpg,w_2f2c0d6 new_whale w_98d094e w_32da935 w_fa7cd91
b0675b37a.jpg,w_e6450bc new_whale w_0369a5c w_595dbd3 w_711b815
4043c4a1d.jpg,w_3378e77 new_whale w_accb0cb w_50f8a28 w_0da34d3
105d4b6b7.jpg,w_9eaef8f w_04003e9 new_whale w_64cddcd w_c684a38
096e5b78c.jpg,new_whale w_f1cd92c w_8fad4d2 w_872f131 w_88065f2
133220144.jpg,new_whale w_e26e0fc w_4f6e5a9 w_1728040 w_17ba5e4
85b822ecb.jpg,w_27be996 new_whale w_fdfd867 w_700f301 w_06d2e72
7829bfc8c.jpg,w_37bdff9 new_whale w_59109e5 w_53ce2e1 w_91005b3
97e038a23.jpg,w_15805cd new_whale w_6f0cbe3 w_2365d55 w_715ceba
8786bec0d.jpg,w_c2c20eb new_whale w_04c9b23 w_591a2c5 w_bc285a6
f0c152b4e.jpg,new_whale w_a33ed90 w_ace2814 w_94da1e2 w_1c63738
4a3bfee55.jpg,w_290399a new_whale w_6c3ec2d w_ba2bbbb w_7395388
685aefa5e.jpg,w_9ca9776 new_whale w_edf0164 w_43d8db4 w_ecb61a0
b271f7efd.jpg,new_whale w_8103832 w_b7cf3f5 w_210b625 w_9db1fb1
78a572301.jpg,w_8cad422 new_whale w_c928809 w_38de45d w_c172767
49c61bd60.jpg,w_b93105d new_whale w_5d36478 w_deda5f7 w_4554dcd
3a6a17330.jpg,w_0a1fcd6 new_whale w_1fb652d w_78fbecd w_43312c4
416b172fa.jpg,new_whale w_b70c09f w_4f8332a w_1286f9e w_a770c8f
6219200df.jpg,w_e096f02 new_whale w_ad88c85 w_9749fed w_9ef6147
443b91c5f.jpg,w_80dfb8e new_whale w_8694cb5 w_8261f4d w_d6283ba
ac5f642c5.jpg,new_whale w_25b2b3d w_700ebb4 w_01f14e1 w_bd25728
8488b43c2.jpg,w_03670aa new_whale w_23a388d w_f0a8b3e w_5d4c7fc
71e13aa44.jpg,w_3180b48 new_whale w_04713fd w_8778b22 w_af294f7
4f4c52bce.jpg,new_whale w_91037a7 w_e493834 w_bc5dbf9 w_89773ab
2efcefa22.jpg,new_whale w_a4826eb w_e966f36 w_e6450bc w_7ae20cf
54cc5ab1c.jpg,w_0369a5c new_whale w_e6450bc w_2644b11 w_b950c88
03f41c1f2.jpg,new_whale w_e73cce3 w_3ae4d85 w_f48451c w_feb4051
821414738.jpg,w_e5b21c0 new_whale w_24ca106 w_8620eca w_0e0f074
53679e92d.jpg,w_5ce4848 w_81ed5f8 new_whale w_2f1488c w_34f5f2d
7891d1ffe.jpg,w_2c29146 new_whale w_12cc52d w_60c073b w_9c86f48
cbddcd2a3.jpg,w_fd3e556 new_whale w_f737a6c w_cb4182e w_8936c44
e431ecba9.jpg,w_fd3e556 new_whale w_8e92662 w_3ea05d5 w_6c2e008
4bf84920b.jpg,w_513f024 new_whale w_83cc0ec w_2b979e6 w_0718183
0c0277706.jpg,w_8b03a7f new_whale w_8de77f8 w_b9c99cc w_99b7ba2
579fbe3c0.jpg,w_fbcfe1a new_whale w_93fddcb w_3e6cee1 w_6c995fd
c10aa0ed6.jpg,w_6ea9231 new_whale w_b6ad668 w_090c801 w_d953953
8f7d64247.jpg,new_whale w_9f02ca1 w_eca61e6 w_1b77e4f w_90c9763
d8bcc6be2.jpg,new_whale w_11d8c70 w_16f4e1e w_620dffe w_b1ea71c
0aa98293e.jpg,w_99af1a9 new_whale w_3e18700 w_0135f5f w_8092f18
cda932674.jpg,w_f787e93 new_whale w_1e85eea w_c172767 w_3bdf2c6
a4b08eff4.jpg,w_2a98962 new_whale w_568e9fd w_7f1f285 w_2644b11
1e2d3a766.jpg,w_985d205 new_whale w_2e4b740 w_e12b78d w_9ffc9aa
1c14ad8f3.jpg,new_whale w_db68456 w_82481c1 w_0729126 w_f437f82
4e74f1aea.jpg,w_bd26110 new_whale w_13aa123 w_ba3c7af w_da16ee8
ddfd20a15.jpg,w_05d52d0 new_whale w_f2dd08f w_535448f w_ed2b6f5
002f52f0c.jpg,new_whale w_a548534 w_e33e588 w_6e97ef4 w_df86a42
691365fd1.jpg,new_whale w_1d1fffe w_48fa708 w_698fcbe w_3499014
78185fb04.jpg,w_365e82b new_whale w_640a24a w_9a2b01d w_b60ef24
1b7b97c25.jpg,new_whale w_4f9c015 w_ace2814 w_c2372df w_80b474e
b09029fc0.jpg,w_0cfdaa5 new_whale w_c97ad94 w_f71de1c w_a3181a0
3c70d47c2.jpg,new_whale w_88e4cbf w_f3179b3 w_4f14413 w_fae5d67
10d82b3c0.jpg,new_whale w_351a377 w_e21b25f w_c80541e w_811c3a3
847607dfb.jpg,w_e8c5ff0 new_whale w_9fc06d4 w_bb9306c w_cfdd1c0
ccee571c4.jpg,w_66e3287 new_whale w_e27bbf6 w_0ee9ae5 w_e8ab3c8
e4e47e7a8.jpg,new_whale w_df34804 w_83e0076 w_ad072b0 w_b45ce21
a7374e038.jpg,w_4846b27 new_whale w_7b06e7e w_c63fd83 w_dc662ea
6fc19a188.jpg,new_whale w_0d43823 w_f3b2948 w_581ba42 w_576026e
1ce0dee28.jpg,w_55ef07b new_whale w_91a2a20 w_6cfa650 w_6ae4956
00a427ac6.jpg,w_1167daf new_whale w_fbcfe74 w_f787e93 w_e05c1a2
4d35014a3.jpg,w_7e1ce0a new_whale w_0a619af w_5b5b849 w_c380132
f7d4b856e.jpg,w_9713cc3 w_17b0d3a new_whale w_aa32f70 w_8d9af77
273f1e39e.jpg,new_whale w_450fccf w_c5afe0e w_cf18ab7 w_60aa749
ef150e31f.jpg,w_c379d78 new_whale w_37bdff9 w_2e5d992 w_3217fd7
07b3e0fee.jpg,w_dd837b1 new_whale w_e79b4d0 w_939a3c7 w_b0ffd3b
bb7fc67fa.jpg,w_691f2f6 new_whale w_0b1e4a6 w_eb3f1ff w_3137deb
cb23138fa.jpg,w_86220e0 w_0323574 new_whale w_fd906cc w_4bf625b
5eb592b49.jpg,w_07cc9c2 new_whale w_41d24c6 w_90c9763 w_c5ec693
403ff2240.jpg,new_whale w_8bc8a32 w_887c387 w_f3addb7 w_a76f0b7
8eeb76c7d.jpg,w_dc27ce9 new_whale w_0d5fa2c w_9544084 w_6ea9231
18d0bfd1b.jpg,w_553d1ef new_whale w_e4a9205 w_8507818 w_6f0cbe3
98e841dec.jpg,w_cc07b1d new_whale w_60b027a w_27272a5 w_c87817e
63cf85211.jpg,new_whale w_eba33fb w_8ea0c7d w_c183657 w_f077a03
ecb588b70.jpg,w_8a6a8d5 new_whale w_3e4b155 w_ecbd28f w_c0e27e9
c27e4452e.jpg,w_5d1b1a7 new_whale w_2b65b34 w_ce352a8 w_f382f59
7cf648606.jpg,new_whale w_8075847 w_db88b61 w_5b40032 w_3c254c1
aae5c1f8b.jpg,w_03670aa new_whale w_6fc9857 w_d4e9763 w_4c206e7
e2b86ba96.jpg,new_whale w_92f64ee w_0cbf1b3 w_bfcad53 w_d84afa9
dcd91ee44.jpg,new_whale w_05d65b9 w_85bb73c w_4214909 w_c554b6f
0cbfdf671.jpg,w_fec331a new_whale w_0bb71d3 w_f7cb97d w_bd1c3d5
a4a18b425.jpg,w_0301302 new_whale w_bb2c919 w_9a5bb2d w_f276da3
bb5980e46.jpg,w_db0027e w_234713b new_whale w_659bdb8 w_abfccb7
c835887c3.jpg,new_whale w_dee1053 w_efa895a w_c8d5ad5 w_c9a569d
c4d6a39fb.jpg,w_a113b33 w_a60f405 new_whale w_712b916 w_55b77ce
b610e373a.jpg,w_2d3ef19 new_whale w_2284d86 w_c5260b8 w_c61a67b
7b635e279.jpg,w_a4140a6 new_whale w_17a3a21 w_f71de1c w_61e4690
752553c8c.jpg,w_df5bf3d new_whale w_0f8b8e2 w_9236fb3 w_0d5a672
74521afb7.jpg,new_whale w_f48451c w_8279f22 w_58bae95 w_46c49e8
59b1d7c43.jpg,new_whale w_0655608 w_1b0c4b7 w_9f13096 w_0fefc62
2a100389d.jpg,w_99f5a1a new_whale w_bd1c3d5 w_b38f64b w_bcba9e8
415955dff.jpg,w_fd6a3ad new_whale w_030c8b0 w_2e9d1b5 w_2ed1e39
698d82f14.jpg,w_244ab03 w_ac0f6c4 new_whale w_7c60e77 w_2b65b34
1f4b14f34.jpg,w_6cb656d new_whale w_cc57ddc w_6b2a111 w_ae70500
bc2726e60.jpg,w_d3311fa new_whale w_68f23a1 w_c16cb2c w_234713b
51e30cc38.jpg,w_0741282 new_whale w_74ada4e w_958b730 w_4640cdc
6bdcf9f09.jpg,w_986cf31 new_whale w_46ba1ce w_b9373bc w_eba33fb
3e795eaa1.jpg,new_whale w_4bc3d74 w_fd6a3ad w_f793b1f w_ca1d5a8
1dd8948e2.jpg,w_e63ea91 new_whale w_f437f82 w_351a377 w_8e63d5c
9dadfa773.jpg,new_whale w_1de6148 w_1efb6fa w_22cdc5f w_63ff0ac
e994cf035.jpg,w_3bdf2c6 w_f787e93 new_whale w_0531ad5 w_914b110
0a3b8a8e8.jpg,w_297e53a w_9f2cfff new_whale w_066ddc5 w_c0d11da
601b0ec0e.jpg,new_whale w_781654e w_d0a7600 w_21ae2d7 w_01e1fe0
2adb14008.jpg,w_90336d0 new_whale w_d15d8c5 w_fe59266 w_deacb11
bb9875158.jpg,new_whale w_857cb95 w_e966f36 w_1a96d7b w_46ea040
b66e463f9.jpg,w_491e1d4 new_whale w_d892cd9 w_9eaef8f w_c875e45
b275a71a9.jpg,w_faf5287 new_whale w_dcd9088 w_81c7c90 w_745ee82
239088895.jpg,new_whale w_e78ecbc w_9d56f22 w_2b069ba w_731fe92
e56ff3ec5.jpg,w_0cbf1b3 new_whale w_6f0cbe3 w_f7d8d22 w_78e7020
c85b9e1a5.jpg,new_whale w_ba668da w_efc5e07 w_08d439c w_224bfc5
4821da73f.jpg,w_9b1ee8e new_whale w_94af7fd w_c01c1f4 w_8778b22
7f6638696.jpg,w_9eb2d2a new_whale w_d0fd41c w_77c86af w_38fc953
07fbe8f44.jpg,w_662530e new_whale w_eae91de w_072f593 w_7b92cc8
af493db4e.jpg,w_1c47899 new_whale w_b0446cd w_14461a7 w_1e283bb
c93fc0552.jpg,w_555dcb4 new_whale w_8c0e550 w_9af432a w_9c506f6
38f989d21.jpg,w_529fa56 new_whale w_f08fb81 w_8ad8cf1 w_d3b48ef
805b48e5b.jpg,w_242fb46 new_whale w_2d99567 w_75b6e81 w_a08f3cd
3f7555197.jpg,new_whale w_193bf22 w_9078d11 w_7e56d66 w_f4a7ad7
e407f760b.jpg,new_whale w_e966f36 w_0729126 w_63ea6fd w_dfdfeeb
81fe37eaf.jpg,new_whale w_4516d31 w_a32ff7f w_c9a569d w_bb2c919
063e305e6.jpg,w_f61b957 new_whale w_f1d2902 w_d2b440e w_bb08804
c30b9a86e.jpg,new_whale w_c85ff1e w_0e2b483 w_3584852 w_8ad2534
0c0918b12.jpg,w_68eaf36 new_whale w_37e08ff w_d494351 w_77c86af
919ec1d13.jpg,w_1082fdc new_whale w_6e7cf1c w_5258623 w_2362d7f
658b1f674.jpg,w_ef30316 new_whale w_b60ef24 w_b70c09f w_ecf39ca
336d9bd8e.jpg,w_04ebfe8 new_whale w_7fcf284 w_faad3f8 w_0066399
96f13934d.jpg,w_50c4067 new_whale w_3dd4346 w_1e3e9a7 w_da16ee8
8ab31a146.jpg,w_faad2b1 new_whale w_c92d4a9 w_da3106e w_fccccec
8da0f8225.jpg,new_whale w_b5e13cd w_553d1ef w_7a91862 w_eb13108
0a437f4f8.jpg,w_0f56fb2 w_5597026 new_whale w_122e247 w_5a3cd6d
02c583932.jpg,new_whale w_9b565fa w_022b708 w_ab2ac77 w_fd3e556
bb52704fc.jpg,w_d3b1733 new_whale w_a32ff7f w_eba33fb w_653dde1
1225d882f.jpg,w_94595ec new_whale w_5c57f77 w_c1715f5 w_f353d20
ed1ffd220.jpg,w_210caac new_whale w_da5b8fe w_55b77ce w_83eaf7e
9e602e86e.jpg,w_b423e9b w_ab2ac77 new_whale w_477f7b1 w_96c35cc
baacab6cc.jpg,new_whale w_82e5785 w_1ee38d5 w_cac17d9 w_11ec829
ff06ec1b8.jpg,w_3002b59 new_whale w_564a34b w_21ecbf3 w_0bdc5d5
f2cf7aaf8.jpg,w_cd4cb49 new_whale w_dd837b1 w_9b5109b w_506ff2f
2ee0018dd.jpg,w_6332313 new_whale w_01e1fe0 w_a4162d6 w_eacf981
a1f7b8caf.jpg,new_whale w_e4d326a w_a24d7b7 w_0af3867 w_736cca3
4bf48759d.jpg,w_b9e5911 new_whale w_9d86594 w_c1b34d2 w_ca93339
ae10f2a7c.jpg,w_5877e51 new_whale w_1920193 w_ece94e8 w_f971ecb
376a9819f.jpg,new_whale w_a5c74f4 w_562b227 w_b39aff5 w_446a02d
5a5ba0701.jpg,w_80fc994 new_whale w_059d9e0 w_101990d w_1217536
811bec814.jpg,new_whale w_47e88ee w_7918564 w_b96391f w_0a2e1ef
0a17df049.jpg,w_9c2f8e2 new_whale w_9c506f6 w_0d61101 w_031e1a3
ba2cbe0e6.jpg,new_whale w_90f0cd0 w_4e13e82 w_5a3dbb9 w_b7aa4d8
ca6bd3486.jpg,new_whale w_6ffc7a1 w_a68cf64 w_1f85037 w_11ac036
dcf360d8f.jpg,w_972e51e new_whale w_1d532b4 w_b54f70f w_abfccb7
e0421d14a.jpg,new_whale w_15b5df2 w_7d5a3b0 w_d0bf381 w_cbcb5ed
2d89f6a9d.jpg,new_whale w_c6fe966 w_79e750b w_ab7c369 w_d22e12a
4a979e8d1.jpg,w_62c78f3 new_whale w_fa4034b w_c554b6f w_490d198
7ef90516d.jpg,w_b1dbfd3 new_whale w_9c506f6 w_77c86af w_efbdcbc
cf673d9e9.jpg,w_dfdfeeb new_whale w_2c0f96c w_f71100b w_e966f36
e7c8f33bc.jpg,new_whale w_d8a47de w_2117e10 w_4c18cce w_817d53c
49069f906.jpg,w_6794f1e new_whale w_18c481a w_6bc4ce1 w_8a9e295
69d779a58.jpg,w_81eb375 new_whale w_8003858 w_d1f35d6 w_c262606
87ee37cfa.jpg,new_whale w_5773c71 w_55b77ce w_a5b6ea7 w_2f94559
fd27628a8.jpg,w_39c246e new_whale w_e3956f5 w_733f661 w_0531ad5
a78e9ef74.jpg,w_2362d7f new_whale w_2284d86 w_e94b46a w_a84be0c
4ca27c9c4.jpg,w_c465f0b new_whale w_88bb921 w_0140c92 w_22a168a
d3405c23e.jpg,w_d97c490 new_whale w_a4d7e8f w_88e4537 w_e1702d4
c148421d8.jpg,w_6dfc3f1 new_whale w_fd99c63 w_0a155b9 w_5816f86
b85867e5b.jpg,w_4adc1c0 new_whale w_6e209a8 w_28cb717 w_71a1a08
60dad0b4a.jpg,w_08d62ee new_whale w_c3e88ae w_cbd5013 w_14f15a0
cbebf7398.jpg,w_bc7de9f new_whale w_115e880 w_2f1488c w_2e231f4
0734b53b4.jpg,w_3904956 new_whale w_77c86af w_0d61101 w_94da1e2
ea2ee400a.jpg,new_whale w_20950a9 w_003bae6 w_7e016f2 w_641df87
431ca9ea6.jpg,new_whale w_551f361 w_d91feb2 w_99c484f w_349c277
27671a1c3.jpg,new_whale w_13937e4 w_f056e82 w_92f4498 w_cbcb5ed
bbbc50872.jpg,new_whale w_cb0aaf0 w_7d4d7cd w_a37815c w_fb8e059
7bf401859.jpg,w_c16cb2c new_whale w_fed1938 w_867569a w_146208a
203c0b5cf.jpg,w_e9605ca new_whale w_234d686 w_d68c135 w_06d2e72
3bba129ad.jpg,w_df54dcb new_whale w_b9e5911 w_700f301 w_953b7b2
ed29ed586.jpg,w_2fdb049 w_0bc078c new_whale w_7c1435e w_911384a
a0d962939.jpg,w_ea6a7fe new_whale w_8a7071c w_b9131da w_bd18f3c
ca10faa15.jpg,w_60a2820 new_whale w_0abdaf4 w_2b65b34 w_83cc0ec
3b6a6fecf.jpg,w_f8bb266 new_whale w_9b89c88 w_8a35001 w_1b6f30f
b55d70827.jpg,new_whale w_472b51c w_b9c99cc w_34941d8 w_9cc2050
37db1a73b.jpg,w_244e953 new_whale w_454df60 w_334c489 w_8279f22
8bad77a8d.jpg,new_whale w_65c24c3 w_409747f w_310a94d w_9b89c88
1b4b93454.jpg,w_f0eddab new_whale w_57abc0f w_187de67 w_abc5af2
633fd788a.jpg,w_88e4537 new_whale w_8a1b71c w_f73788a w_122e247
25e99e04e.jpg,w_1133530 new_whale w_abc82c3 w_eba33fb w_60a54be
24daecb3a.jpg,w_5831e13 new_whale w_bfe77d0 w_f1b016e w_6525e6b
ce251ddb2.jpg,new_whale w_83b2336 w_fad9574 w_c650f39 w_6dc5981
b70d0318d.jpg,new_whale w_df32eec w_1b8f126 w_7d5a3b0 w_9109577
fc263f239.jpg,w_12fe3a8 new_whale w_3fb99a3 w_47aa042 w_c4b02b0
2cf7c69f4.jpg,w_a335fc2 w_c99807e new_whale w_2ec0a71 w_18a06fd
67778f1db.jpg,w_06ffb30 new_whale w_0a2e1ef w_dd944b7 w_a939b64
777b014fd.jpg,w_2ed0d2f w_7537a43 new_whale w_e818b1a w_1032bb6
f05412ee6.jpg,w_d72771c new_whale w_740c748 w_e9605ca w_5c3f03f
223d82225.jpg,w_8c28a3c new_whale w_eced610 w_09bd7e8 w_8d09425
c6f670e50.jpg,w_e25b062 new_whale w_007fefa w_dc662ea w_1f78a1e
ce461124c.jpg,w_0e35358 new_whale w_e8c45dd w_21b94e3 w_16f4e1e
1cf6fe843.jpg,w_fccac74 new_whale w_44a6509 w_bc285a6 w_ee864e4
01c91eadc.jpg,w_093ea58 new_whale w_6f0cbe3 w_9aa9809 w_fc6dd24
718b4f585.jpg,w_2117e10 new_whale w_3eae264 w_b6e4761 w_9b3076d
8fd64b91b.jpg,w_7ea6bf2 new_whale w_e9a2c15 w_9d22d21 w_62c78f3
c7415a20a.jpg,w_927dcdc new_whale w_c5260b8 w_2ddcce9 w_9e18daa
e4919c98a.jpg,new_whale w_e8b2157 w_d15d8c5 w_6caff0f w_9e18daa
25c0664bc.jpg,w_c0e2505 new_whale w_90fb95b w_a47dc2d w_d3332dc
c0b2ecf1d.jpg,new_whale w_3a2686e w_66168f1 w_95f78f6 w_dfd0ae8
e2ef8925d.jpg,w_981075b new_whale w_16f4e1e w_6840783 w_a5a002f
a410a277c.jpg,w_b9373bc w_e39f7d5 new_whale w_0788c36 w_3f8ff7c
4e67e3409.jpg,new_whale w_02545ea w_c073f96 w_a7d01cb w_68d1fb0
a65170f11.jpg,new_whale w_9b5109b w_5530579 w_5d90c48 w_8b84ad0
0c3379921.jpg,new_whale w_cc1784d w_83e0076 w_71fbd51 w_686c0b3
3bebe67aa.jpg,w_9fecf9d new_whale w_b7b1472 w_022b708 w_f37c434
1d6701d80.jpg,w_4c07458 new_whale w_de657c1 w_ce66f9a w_6df47c6
80bbf30bb.jpg,w_8a4618d new_whale w_eaed433 w_9b3076d w_a8b34a0
d8d951ce8.jpg,new_whale w_5390260 w_d6283ba w_c156d0a w_62c76f3
98ee3a492.jpg,w_037b23f new_whale w_f056e82 w_c183657 w_cbd2194
48a937823.jpg,w_fd57399 new_whale w_7e0659e w_8a35001 w_72db52b
dabb2cffc.jpg,w_8e9f047 new_whale w_8261f4d w_ce5c5eb w_a31ead9
6a90170e5.jpg,w_d0528f6 new_whale w_b3ca4b7 w_480d478 w_51e7506
fc7700558.jpg,new_whale w_b38d36d w_cdb8e7f w_e0d3a78 w_971d191
f3daf9823.jpg,w_84343d7 new_whale w_4690940 w_e1f57e7 w_94e136e
12d39f3e1.jpg,new_whale w_6310ac7 w_ee05147 w_36828b8 w_2e4cb98
7758546f5.jpg,w_420254e new_whale w_fd6b0da w_bef0a5d w_249346b
447f4675f.jpg,w_17338da new_whale w_042b547 w_9786485 w_c7d8935
5e5404a1a.jpg,w_bfcad53 new_whale w_18934ab w_0301302 w_8c83452
91e5e4b40.jpg,new_whale w_416168a w_d64a9fa w_4fdb4c1 w_5db0eb7
063752d10.jpg,new_whale w_f19aeb4 w_1a7ccaf w_3132fce w_2a946f2
690d7b766.jpg,w_213fb07 new_whale w_c9634dc w_adb1dff w_6ebfe7b
8ad20637d.jpg,w_7737f65 new_whale w_ba9804a w_7dd1222 w_c028816
c6072cf01.jpg,w_b5657c7 new_whale w_c80541e w_b2a4769 w_f8bb266
56c95f2e9.jpg,w_2c7deff new_whale w_2e706fc w_bad166a w_d8b5bb4
743f2b25d.jpg,w_4c0a2c9 new_whale w_3eae264 w_8b86b95 w_488865e
276513d28.jpg,w_16df050 new_whale w_d4fc12d w_ed29ffe w_35614d4
8d4cde07e.jpg,w_d588fb4 w_0bc078c new_whale w_a47dc2d w_fd99c63
824234b8d.jpg,w_70e9661 new_whale w_e36b021 w_67a270c w_14bfbe2
011490ea7.jpg,w_a5c74f4 w_c98aaad w_34ecf36 w_cac17d9 new_whale
64de9bde0.jpg,w_d4fc12d new_whale w_1d9592f w_31b5dd8 w_89f0c48
d16eff30e.jpg,w_7709151 new_whale w_3aecb5c w_90f0cd0 w_b9d5945
c6393d862.jpg,w_e1c796a new_whale w_6aca6f9 w_6cda039 w_07125ed
a4e17c500.jpg,w_f353d69 new_whale w_5d5c6a6 w_dee8b12 w_fbf7d73
1fdb6c6f1.jpg,w_66c5323 new_whale w_97d60b9 w_9eb2d2a w_1daae48
55ac09c20.jpg,new_whale w_314bc30 w_086f404 w_e27bbf6 w_aa585b1
5ea7cae7e.jpg,w_0135f5f new_whale w_f05a1df w_81aa796 w_15b5eb1
744b8feb9.jpg,w_5b8f665 new_whale w_03ad89c w_877de07 w_54c535e
d63e52c0f.jpg,w_77f9c5f new_whale w_db0c461 w_197979e w_289778b
3f45b5123.jpg,w_fb0c41f new_whale w_445a265 w_bfecb74 w_f437f82
cc70e7bd7.jpg,w_aa0bd3b new_whale w_9f13096 w_6d8f72e w_e34ff4a
ff5892492.jpg,w_60cf87c new_whale w_91cc02c w_ddff916 w_8e74601
df13985c2.jpg,new_whale w_f4fae33 w_625e590 w_260b2ac w_bd1c3d5
3d4072ad5.jpg,w_7656c1a new_whale w_edf43c1 w_3137deb w_cafe0d0
630050307.jpg,w_3dd4346 new_whale w_b3c3fa5 w_9525c07 w_72db52b
cfcc21b0e.jpg,w_5665c80 w_7aea0b8 w_2745292 new_whale w_5796069
429521aa4.jpg,w_8a1b71c new_whale w_0f8b8e2 w_88e4537 w_7cb0e92
d905f4b2a.jpg,w_f10aaf0 w_89f6097 new_whale w_5999d7a w_3e5a926
7ba0a471e.jpg,w_22b8752 new_whale w_9573686 w_f765256 w_bc7de9f
e7a1b85a0.jpg,w_82481c1 new_whale w_8c25681 w_74f9ede w_9387099
c2790e7c9.jpg,w_d3b6c6b new_whale w_9119b08 w_75d4e65 w_b48ce14
092947f89.jpg,w_a31ead9 new_whale w_2f74ff3 w_bd572cf w_84b1b28
4efe8b214.jpg,new_whale w_30f2f0f w_86fa148 w_19fb122 w_4a1b777
3ab77e041.jpg,w_2852461 new_whale w_e6450bc w_be776c7 w_16df050
b9a7bf09a.jpg,w_ae53e45 new_whale w_21b3c7e w_1457f13 w_0ea7436
4671c5038.jpg,new_whale w_6a0a4c8 w_de8def8 w_7dd1222 w_27a6304
bd9a84fd4.jpg,w_d06e2d0 new_whale w_3982e1e w_16f4e1e w_28a16b0
b6ff41274.jpg,new_whale w_950c471 w_1457f13 w_56fcc39 w_2e4af64
8f2866e5f.jpg,w_358c519 w_3154c82 new_whale w_0532483 w_1b5b199
5fc9a9630.jpg,w_0887d9b new_whale w_8d4c9f7 w_4135cb8 w_9b171a8
803485430.jpg,w_6822dbc w_e20dcb5 new_whale w_0cbf1b3 w_eae8af4
8db62d009.jpg,w_4c47a31 new_whale w_d351889 w_c9a569d w_6f62459
f51d41780.jpg,w_aa0dacc w_b82d0eb new_whale w_415dea0 w_08630fd
02950682c.jpg,w_ec0d867 new_whale w_7c5fa3c w_c4232a3 w_a939b64
9030b3348.jpg,w_f391bb0 new_whale w_fdd3687 w_80124ae w_3207433
10bc7b241.jpg,w_7a083f7 new_whale w_a371235 w_d4b1766 w_e885d82
9df7a8006.jpg,w_04003e9 new_whale w_3de579a w_9eaef8f w_872f131
5791b9b27.jpg,new_whale w_52a5d92 w_c9d479f w_996dca0 w_cbd2194
ea5f86a2a.jpg,w_97146b3 new_whale w_06471d5 w_f314516 w_687c6d3
a5b483b11.jpg,w_210b625 new_whale w_1ca7433 w_cd4cb49 w_8ad632d
18bdbdfa8.jpg,w_f08fb81 new_whale w_4bf625b w_d98ba44 w_9ca67be
35353f094.jpg,w_ebe9709 new_whale w_8ac1fd6 w_c684a38 w_2f702db
b8ffcad73.jpg,w_dba1c08 new_whale w_be06898 w_cefd512 w_88e4537
b34688d4c.jpg,w_276390d new_whale w_0bc078c w_e1f57e7 w_1ccd2a1
c7a79f642.jpg,w_778e474 new_whale w_6310ac7 w_362ebae w_e819d10
ea4148643.jpg,w_f15f7be new_whale w_40acf40 w_108b2ed w_d3734df
9d6ade220.jpg,w_007fefa new_whale w_a8fcebc w_5597026 w_5d4c7fc
2aba747c4.jpg,w_59052ad new_whale w_2f8de4f w_f7234f1 w_83d1ab6
15cf50029.jpg,new_whale w_7e5b9da w_936aa13 w_7122684 w_c4c380f
b4da6e3a3.jpg,w_48a6027 new_whale w_ae536d6 w_470be90 w_c5e8495
98dfdf2a7.jpg,new_whale w_2059146 w_16f4e1e w_25f1a4e w_8d0d921
61f13d5b4.jpg,w_dc642b6 new_whale w_78e6713 w_8a1786f w_e68c38c
a4059f04e.jpg,new_whale w_b07ec5d w_c7d8935 w_d24c654 w_2b47174
fe2d0e1c9.jpg,w_5cf4727 new_whale w_704a8a1 w_09de1a5 w_72fc6e4
98e1ea193.jpg,new_whale w_4690940 w_c7cda47 w_68df91a w_358cda3
cee2c448f.jpg,w_d8ae71c new_whale w_1b7eaad w_861e504 w_6172f4a
af8568e7c.jpg,w_f201548 new_whale w_aebdb5f w_ca11f46 w_c1d2fbe
41a023288.jpg,new_whale w_76b8e6f w_f864358 w_9614e63 w_55a34c7
759784fcc.jpg,w_e8b0946 new_whale w_21ae2d7 w_ac33bfe w_b0d1046
d59cfd2a7.jpg,w_881fca8 new_whale w_0abdaf4 w_782c71d w_36bbd71
8e0f2b2e1.jpg,w_f3887f1 new_whale w_2c0f96c w_57bf435 w_5d67caa
84d5dcb9b.jpg,w_ce44322 new_whale w_1693b27 w_88503f1 w_50fd107
18c1e0336.jpg,w_5116e7e new_whale w_755fc10 w_28cb717 w_c1efffb
152fd62f7.jpg,w_abf193d new_whale w_7c5b20d w_59d1835 w_6465d75
b857ddfec.jpg,w_bfe77d0 new_whale w_650f587 w_5831e13 w_d6f0be4
57c48fd5a.jpg,w_2592960 new_whale w_1fb652d w_e3956f5 w_f24a55c
de74478c6.jpg,new_whale w_f5fcb45 w_7395388 w_595dbd3 w_2365d55
7f11ea59a.jpg,w_3de579a new_whale w_06150e1 w_58f3fd4 w_6d8b67b
000dcf7d8.jpg,w_4132bb8 new_whale w_c1b90d1 w_16df050 w_a2a40d2
24475ba59.jpg,w_6943d6f new_whale w_bd26110 w_b6e4761 w_bfecb74
487cfb594.jpg,w_e20ff88 new_whale w_6aab519 w_3584852 w_c797292
509968029.jpg,w_fd3e556 new_whale w_263bd97 w_1759e4e w_90fb95b
5765c6d62.jpg,w_d3734df new_whale w_fc0cb69 w_ec7e60a w_9fc06d4
3949d65ad.jpg,new_whale w_3de579a w_d066f46 w_c8bbb43 w_343f088
519db8bd9.jpg,w_27a6304 new_whale w_0bfdcca w_e2530bf w_6a1280c
7a424c980.jpg,new_whale w_05f8c99 w_6e3b6a5 w_564a34b w_801e723
dfc76b29f.jpg,w_ef439a1 new_whale w_f48451c w_bfed9c6 w_69edff7
62ee33c5d.jpg,w_ad6df15 new_whale w_92f4498 w_cbcb5ed w_de8def8
e3df20e37.jpg,w_91037a7 new_whale w_42e0e40 w_fe9eac7 w_9732911
49d68fdcb.jpg,w_26a55ed new_whale w_bb086fc w_2e29743 w_c640984
e52e6188c.jpg,w_314bc30 new_whale w_3ef0017 w_e2d8b09 w_48b1730
cc5360c6f.jpg,w_f353d69 new_whale w_fbf7d73 w_d892cd9 w_9eaef8f
bb7b07e3d.jpg,w_2652d72 new_whale w_22d96e7 w_f5bf6df w_be06898
4d52e76e6.jpg,new_whale w_1029215 w_dc23fbc w_da16ee8 w_97ba78a
c85b4651a.jpg,w_1e3b8e8 new_whale w_f5baf10 w_0531ad5 w_bfe77d0
c73f9a80d.jpg,w_789c969 w_f0fe284 new_whale w_9a9a2c8 w_7c6e8f0
aa063c901.jpg,w_d2b7856 new_whale w_3feca90 w_c7d8935 w_f3179b3
cd0286bac.jpg,w_0369a5c new_whale w_3b71107 w_c63c580 w_69b046b
4ab6eb239.jpg,w_7656c1a new_whale w_8d0a2a2 w_cafe0d0 w_3137deb
de49f72d9.jpg,w_a33b6d6 new_whale w_5650932 w_3bd976e w_836581c
d598d6858.jpg,w_7c718f4 new_whale w_fa70157 w_881fca8 w_89db63b
0dcf2fcf0.jpg,w_3da0eae new_whale w_51fc1fc w_e11afff w_15b3f09
efddaaf19.jpg,w_82479e4 new_whale w_c713416 w_066ddc5 w_877de07
4e22cb67a.jpg,w_0fdde23 new_whale w_0ca546b w_9a1a810 w_84c23bb
62f9d6f83.jpg,w_94f41dc new_whale w_f9aab0c w_b5e6c9c w_0a0c768
aa44a59d3.jpg,new_whale w_8af65ed w_9b6d9b7 w_8beb9f1 w_df32eec
0fff6f428.jpg,w_f1eb6cd new_whale w_c2677ee w_5871dfd w_1666216
4cbdbb886.jpg,w_f06a10d new_whale w_84d832d w_a371235 w_ae536d6
25a498d64.jpg,new_whale w_bfe77d0 w_105b860 w_1b6f30f w_8c959a6
55ba8cf65.jpg,w_d892cd9 new_whale w_20df2c5 w_0a619af w_9ed5f69
8bd2b988d.jpg,w_fec4ddf new_whale w_08d62ee w_40a8585 w_c058057
13d309a13.jpg,w_df32eec new_whale w_8947728 w_f1d2222 w_74e6a59
6b1e387f3.jpg,w_e9e413e new_whale w_f971ecb w_d97c490 w_f6bae1a
65fff5e87.jpg,w_0b398b2 w_5a3e0de w_2df85e7 new_whale w_916c746
c8ce2f65d.jpg,w_5833b3d new_whale w_e51c0e9 w_1b5b199 w_6301785
70fa2acc3.jpg,new_whale w_fea5f70 w_a6f9d33 w_e11afff w_10f4afc
a7a28e411.jpg,w_aa2d6fc new_whale w_7ea6bf2 w_f4fae33 w_fbc7895
946305925.jpg,w_b5d45d4 new_whale w_5841fb9 w_7272aa5 w_69cce86
6d1012edf.jpg,w_b8c537a w_179c9f0 w_e21b629 new_whale w_9094c50
15be10258.jpg,w_1ca9ab1 new_whale w_adedd1f w_a24d7b7 w_76e67dc
7283ed735.jpg,w_a2f8488 new_whale w_b475feb w_85d9e99 w_83eaf7e
478ce2295.jpg,new_whale w_9ce3725 w_e20dcb5 w_9fecf9d w_23a388d
09f1cd66d.jpg,w_8c25681 new_whale w_d68c135 w_fd3e556 w_263bd97
0b6f58d39.jpg,new_whale w_6b28b1c w_9728637 w_5cc8711 w_74e6a59
a009a15ce.jpg,w_0369a5c new_whale w_3b71107 w_aea4301 w_0630c3e
36973e99c.jpg,w_f737a6c new_whale w_fd3e556 w_3ff6d0e w_46e198f
d0fe179db.jpg,w_f74a89e new_whale w_2b4b82e w_a70b90b w_974c37d
1dbc71f0a.jpg,w_fe95c92 new_whale w_bd572cf w_21ecbf3 w_0bb71d3
f2501fe62.jpg,w_0c80c53 new_whale w_39f3e3a w_d2b440e w_3eae264
5fd4e8c42.jpg,w_e1c5b57 new_whale w_e53bb95 w_76dee7c w_b7babc0
11fb91e7f.jpg,w_63ff0ac new_whale w_5ea7acf w_1de6148 w_c6fe966
9449dea2b.jpg,w_1c39fb1 new_whale w_799b208 w_58f3fd4 w_45e2fc0
dac7f10b4.jpg,new_whale w_9ad3618 w_292956e w_1c63738 w_67a9841
11664decf.jpg,w_9b5109b new_whale w_4d62749 w_1f41b98 w_8a1786f
c69a7f652.jpg,w_8a06b46 w_7aea0b8 new_whale w_1b0db58 w_3c58b68
12108a49b.jpg,w_81d1ff9 new_whale w_4ac340b w_37e61c2 w_cac9bdb
473b858d4.jpg,new_whale w_0886321 w_7830b52 w_65e0628 w_f3a12bc
a09d165b3.jpg,w_1d532b4 w_b54f70f new_whale w_eacf402 w_b99f945
33ba70942.jpg,new_whale w_19671ad w_eae8af4 w_29e8496 w_6822dbc
3829b140f.jpg,w_d9aecac new_whale w_b72dc3d w_c5260b8 w_fb6fbcb
1c8d579b1.jpg,new_whale w_955bfe2 w_fd3e556 w_5116e7e w_3cde3ea
0ede082e6.jpg,w_b9bae7f new_whale w_67a270c w_8a7071c w_2efa6ab
0a2a6904f.jpg,new_whale w_f1ec368 w_0a3255c w_18645ff w_1a7ccaf
7f6b86ff0.jpg,new_whale w_1b0c4b7 w_c2873ef w_bd4e5dd w_7521a81
32b85e970.jpg,w_5fd90e2 new_whale w_bca4304 w_a88c767 w_4441671
06d511f0e.jpg,w_14330a0 new_whale w_46f4824 w_7d8b00d w_a8b34a0
802330ff6.jpg,w_a24d7b7 new_whale w_cc1784d w_5b227ec w_4f3dc75
714572bbc.jpg,w_671b041 new_whale w_62ec5a8 w_aa45520 w_bbfce38
1bbc2e494.jpg,w_8a71ca4 new_whale w_6e8c101 w_f28a7a2 w_b4ab5b5
861e6c332.jpg,w_887c387 new_whale w_659bdb8 w_32e705d w_48cc590
e6a20c522.jpg,w_c8f9c4b new_whale w_f58da65 w_d68cf7c w_faac069
16fb6303c.jpg,w_e76dcfe new_whale w_b953028 w_9bebed8 w_eafacda
b3d693675.jpg,new_whale w_ea6a9f4 w_208db25 w_b569e70 w_63f5740
7c902bf9d.jpg,w_cbd5013 new_whale w_b5e6c9c w_13ae3d4 w_1788910
9766d9b89.jpg,w_ecf39ca new_whale w_b70c09f w_c7a611a w_f3b6937
7db21342f.jpg,w_95b6fde new_whale w_b1be75f w_5045d2c w_1baf8df
77bd40fe1.jpg,w_99e43ae new_whale w_d066c0a w_8a1786f w_a687883
2ef365726.jpg,w_307e5e9 new_whale w_715ceba w_088cda7 w_17b0d3a
ece47f123.jpg,w_c2de607 new_whale w_a6703dd w_e4d305b w_e069b6a
d9291eb54.jpg,w_bfed9c6 new_whale w_840061a w_780c931 w_69edff7
7fabe773d.jpg,new_whale w_bfe6992 w_428ca58 w_e54d8f6 w_b5c90a5
7c1b0691e.jpg,w_81c7c90 new_whale w_2efa6ab w_84343d7 w_dcd9088
