Image,Id
d1e25d9f6.jpg,w_45867cd new_whale w_dcc6f42 w_70e9661 w_94f41dc
3afb07efb.jpg,new_whale w_efe3a39 w_012678c w_f7e29b4 w_f497e3f
ea6933183.jpg,w_581ba42 new_whale w_07125ed w_260b2ac w_e08506c
0b9520529.jpg,w_d140497 new_whale w_2f4be30 w_b60f441 w_9227ca2
8ff719d2a.jpg,w_c25d2d1 new_whale w_d52a837 w_a059841 w_6301785
baaa3973b.jpg,w_e922901 new_whale w_5f20f03 w_4524517 w_04c9b23
a3dff9d80.jpg,w_7e07b6a new_whale w_2b49489 w_ae19ff0 w_60122fa
717e2fe32.jpg,new_whale w_21ae2d7 w_2926c77 w_3334d3f w_dfc9865
579cd675e.jpg,w_1b50676 new_whale w_5b8b487 w_3e6cee1 w_84714f4
df45e46f6.jpg,new_whale w_3e34a5f w_bfe77d0 w_9b171a8 w_8041789
f16696cef.jpg,new_whale w_478d73b w_4554dcd w_06e6d5f w_243b654
57ac48d7f.jpg,w_c06798f new_whale w_f16afc2 w_a371235 w_5df7574
a3b2cc4de.jpg,w_0003639 new_whale w_e04d084 w_04713fd w_c073f96
21253f840.jpg,w_4249f01 new_whale w_c1d2fbe w_df3b4cf w_4a1b777
ce38291b5.jpg,w_7a427f2 new_whale w_a95c680 w_1f85037 w_c7d8935
d01d03a3b.jpg,new_whale w_9852689 w_e5af4aa w_d6ca28d w_861e504
412d0ff87.jpg,w_34ecf36 new_whale w_25f1a4e w_859dbc3 w_0513962
c238cbe88.jpg,w_75f6ffa new_whale w_32da935 w_9d56f22 w_7342df0
6401ffbcc.jpg,new_whale w_cc1784d w_ab2ac77 w_5773c71 w_3499014
a923990c0.jpg,w_ff5fc91 new_whale w_89f6097 w_6b2ecc8 w_102e715
55d628e47.jpg,w_799b208 new_whale w_1da93f8 w_2ddcce9 w_5258623
d0cf0273b.jpg,w_faad3f8 new_whale w_04ebfe8 w_9eb6492 w_c063530
af34359c8.jpg,w_62bedea new_whale w_9060d27 w_e99ed06 w_19410fe
89c4afcc6.jpg,new_whale w_af1d57b w_a9304b9 w_dc23fbc w_84f08b7
e1aa5a2bb.jpg,w_563d4b1 new_whale w_78e7020 w_553d3d0 w_9b99992
e11279003.jpg,w_e86689c new_whale w_2d99567 w_7b06e7e w_c16cb2c
15640fa78.jpg,w_6bee56d new_whale w_be2ce29 w_4cc050e w_ae53e45
de82ec079.jpg,new_whale w_776f336 w_8affab2 w_f793610 w_6a1280c
6b91111cf.jpg,w_7f4e31e new_whale w_cfa9fb2 w_2b65b34 w_5a8902d
5496fd06f.jpg,w_68b59dd new_whale w_51fc1fc w_722a04a w_4ff2f4a
84c30aaf7.jpg,new_whale w_80124ae w_900c68f w_3137deb w_f5bf6df
a3045c484.jpg,w_53aa231 new_whale w_5a696c2 w_a6eaf8d w_49afbc9
f88927b97.jpg,w_e16924b new_whale w_c7d8935 w_310226c w_30f2f0f
af4e7a934.jpg,new_whale w_4801beb w_ba01717 w_04c9b23 w_de09116
75d5e36a0.jpg,w_98bac23 new_whale w_5ce9577 w_29c0caf w_8301946
87aabbd5b.jpg,w_e99e430 new_whale w_aa0dacc w_d357277 w_d77337e
9da9bfb27.jpg,new_whale w_022b708 w_a2f8488 w_659bdb8 w_580ba51
45a012573.jpg,new_whale w_04003e9 w_9fecf9d w_cf1551f w_0323574
37a8332a1.jpg,w_a69ac05 new_whale w_c55c51d w_8e9f047 w_0277a07
6e21dba65.jpg,w_efa100e new_whale w_97ec13c w_9297b97 w_d953953
5cf81cb37.jpg,w_0b3e0e6 new_whale w_af1d57b w_df487e8 w_353d249
947690b58.jpg,new_whale w_1b1dd05 w_25d662d w_1f41b98 w_352445a
88495a329.jpg,w_48619b3 new_whale w_6d80008 w_11ec829 w_6f7611c
8f855870b.jpg,w_2f8de4f w_f7234f1 new_whale w_d0589c5 w_3ebfe7a
77ce2b46a.jpg,w_51052c2 new_whale w_6041acb w_c073f96 w_2a7c1af
b7a783262.jpg,new_whale w_dcd9088 w_35863c5 w_db2d2ac w_e142c82
2f199ca48.jpg,w_86fa148 new_whale w_1a7ccaf w_a05181b w_c5c01af
27a21b10e.jpg,new_whale w_a10e633 w_88503f1 w_09bd7e8 w_19fb122
d19bf7ea9.jpg,new_whale w_88b3466 w_01fc429 w_3f21fed w_f0cf3f6
b00a9fb59.jpg,w_bef0a5d new_whale w_91b678a w_488865e w_63ea6fd
6a608498b.jpg,w_2a1a012 new_whale w_f57fb81 w_06376db w_fc6dd24
0350e1267.jpg,w_659bdb8 new_whale w_2409871 w_4af7c01 w_78e7020
b5067430d.jpg,new_whale w_bb7d9d5 w_a6703dd w_8da30ad w_628a326
6b9807d10.jpg,new_whale w_ef7824d w_d2c2be0 w_fd57399 w_8a35001
8940c9ccb.jpg,w_d66d8f4 new_whale w_18ca0f1 w_d573a68 w_4df6c4b
f97e5dda8.jpg,w_cf5d69c new_whale w_42e0e40 w_e2372d6 w_9ff0b7b
a9c3d8c5a.jpg,w_5077be0 new_whale w_57abc0f w_fc83ab4 w_0513962
0a946e283.jpg,new_whale w_13ae3d4 w_a37815c w_dce66a9 w_ffcf5fe
299e8b8d6.jpg,w_80bb6c7 new_whale w_6cda039 w_103aca2 w_d9cdc09
2c5bfcc21.jpg,new_whale w_df32eec w_d9a3c6e w_5b463cf w_6fed7c4
ee55f5ab8.jpg,w_0d54c55 new_whale w_e4b4611 w_aa585b1 w_25d662d
9aec48f90.jpg,w_9bd2794 new_whale w_be4f189 w_fbf7d73 w_76b8e6f
5221f1948.jpg,w_d006897 new_whale w_9697236 w_a48fa24 w_1b0c4b7
64229c344.jpg,w_b1d49c5 new_whale w_41a2f20 w_afe18e4 w_4312b77
45c235dbb.jpg,w_bc9188e new_whale w_bf41c21 w_ab7c369 w_1ecca2d
1431407be.jpg,w_59109e5 w_53ce2e1 new_whale w_15b5eb1 w_0a1fcd6
ed117b366.jpg,w_7ae9946 new_whale w_53215c6 w_d9a3c6e w_5c57f77
d4c894ca0.jpg,new_whale w_39efa30 w_64055b4 w_a49508b w_544128b
05b6fbe96.jpg,w_3982e1e new_whale w_cd6743e w_d06e2d0 w_bfbf205
ecbf0dc94.jpg,new_whale w_fccccec w_b9131da w_5773c71 w_c6fe966
7dac9d96c.jpg,w_5665c80 w_7aea0b8 new_whale w_2745292 w_09c737d
2f39a0fcf.jpg,w_3dc1e42 new_whale w_438dd0b w_861e504 w_9e73e1b
bfe8858e1.jpg,w_86220e0 w_0323574 new_whale w_7e579dd w_0d61101
14f0e1496.jpg,new_whale w_ea6a9f4 w_8e04a78 w_cf31c86 w_859dbc3
2f80d3c07.jpg,w_f7d8d22 new_whale w_edce644 w_04003e9 w_bd1c3d5
bf85a70d6.jpg,w_89f521e new_whale w_9b9602c w_9696e76 w_6bc4ce1
c63be9e51.jpg,w_fe59266 w_6b2a111 new_whale w_b5e6c9c w_cf8cd88
aba052ce4.jpg,w_e1b8378 new_whale w_75d4e65 w_df54dcb w_a1b7b83
11269d091.jpg,new_whale w_73d6671 w_b60ef24 w_243b654 w_e0cf908
3b02c97be.jpg,new_whale w_df71327 w_66dd189 w_faab6df w_104d305
bf197172b.jpg,new_whale w_b3b887d w_2a946f2 w_cc1784d w_19f365e
2c56284d0.jpg,w_0833a92 new_whale w_511b9b5 w_5b262f1 w_e73cce3
5654b5d83.jpg,new_whale w_94f4850 w_3334d3f w_03e3e5e w_274d994
19cc7557f.jpg,w_bf7c89a new_whale w_ad88c85 w_3a63e33 w_551f361
01d0bd024.jpg,new_whale w_3511bc7 w_e8e08e6 w_0032a46 w_8092ea7
d23376dba.jpg,new_whale w_f7cd240 w_b09e884 w_c06798f w_40a8585
72c2369af.jpg,w_2f0416b new_whale w_48872ad w_f3f887e w_3f93ee8
895ea772c.jpg,w_34ecf36 new_whale w_a5c74f4 w_3815890 w_dea6580
ad9281e91.jpg,w_3879fa0 new_whale w_a6a732d w_18f9d19 w_9119b08
5c8e322b0.jpg,new_whale w_a95c680 w_c1e1867 w_15b3f09 w_3b03245
ed7934d37.jpg,new_whale w_700ebb4 w_88e4537 w_aec2b6d w_d945006
9ba9e30f0.jpg,w_9be7408 new_whale w_30f2f0f w_96c35cc w_f737a6c
01d48763a.jpg,new_whale w_b785729 w_5b40032 w_82e7319 w_cf18ab7
85d4af670.jpg,w_3ae4d85 new_whale w_c5260b8 w_67153b4 w_533fe25
6242a7117.jpg,w_fae5d67 new_whale w_b48de8c w_e8c45dd w_f3179b3
aeba404b7.jpg,w_9614e63 new_whale w_4460861 w_59052ad w_7e74b4e
7d2ffa0e5.jpg,w_1f78a1e new_whale w_2f1488c w_480d478 w_98164c0
3830ce191.jpg,new_whale w_ec8ac93 w_19f365e w_9ddb645 w_8d71480
41c3b6350.jpg,w_579e5f0 new_whale w_8936c44 w_3f5e8d7 w_d8fb98d
11f6318e3.jpg,w_4135cb8 w_7d6527e new_whale w_bc677de w_d7998d1
f24165afc.jpg,w_3fc3c61 new_whale w_a8fa5f2 w_9d86594 w_19f365e
d0e626bf6.jpg,w_75b6e81 new_whale w_242fb46 w_dea40e2 w_87ed7a9
f0211daed.jpg,new_whale w_6cec90c w_dcc14b3 w_d91feb2 w_95c7a6f
1e446dd80.jpg,w_c2a1bc4 new_whale w_3d1f606 w_b9ee9d1 w_74c924a
0aeb3fd4f.jpg,new_whale w_15805cd w_955bfe2 w_8003858 w_a6a1bea
0ade78f0b.jpg,w_401f5a1 new_whale w_bca4304 w_5b40032 w_ae6ac74
9a7c74222.jpg,w_09c59c2 new_whale w_e918d4c w_2d6596f w_41d24c6
4cdd31702.jpg,w_fd6a3ad new_whale w_836581c w_9dbdb42 w_cbda0d3
e97924519.jpg,new_whale w_3c80f07 w_3154c82 w_8cfabed w_cffd90e
a07bbd6a7.jpg,w_e4ed810 new_whale w_f7234f1 w_21b2790 w_7e56d66
a64fccd53.jpg,w_0e1eccb new_whale w_26ba5fd w_7f762d8 w_b9c99cc
c1ba2f277.jpg,w_090c801 new_whale w_68311ed w_68a89b5 w_a3b1a48
3ff5945fd.jpg,w_7e56d66 new_whale w_1ccd2a1 w_16c264e w_4524517
b6953291b.jpg,w_59052ad new_whale w_0c69117 w_3ebfe7a w_6cfa650
08f85605f.jpg,w_c0d8dcd new_whale w_e6faba8 w_074530d w_a123aa1
de3b74da1.jpg,w_4c2af2c w_c562266 new_whale w_3c629a2 w_1ff168e
70a96d168.jpg,w_7f4e251 new_whale w_25085e0 w_4fadedd w_ba0751c
d9a8c0dfe.jpg,new_whale w_afdac76 w_0135f5f w_88e4537 w_d97c490
cc1e0f7e5.jpg,w_0db234e new_whale w_038e5c3 w_66b4513 w_a491df7
e8223df28.jpg,w_73b6699 new_whale w_5b8f665 w_ad3a043 w_6dc5981
a0ccfd95d.jpg,w_06f3291 new_whale w_0ad0f5b w_d494351 w_7834cde
b75883f99.jpg,w_63f5740 new_whale w_b569e70 w_5823d7b w_fd9d727
86fa93cd9.jpg,w_653099f new_whale w_022b708 w_9ca9776 w_4f9c015
b1102d072.jpg,w_ab2ac77 new_whale w_2ec0a71 w_da011a1 w_cfce505
0bcf9ce11.jpg,w_446a02d new_whale w_922e139 w_2e1416e w_861e504
b3a58d724.jpg,w_9713cc3 new_whale w_8d9af77 w_2fcfc71 w_17b0d3a
16cf8277c.jpg,w_7537a43 w_2ed0d2f new_whale w_e818b1a w_b2e75dc
a186aeac1.jpg,w_94a7669 new_whale w_c01c1f4 w_984bb5c w_fd3e556
4afb9eb3c.jpg,new_whale w_502e72f w_e090471 w_7983f71 w_c70fbcd
9afa3e628.jpg,w_9e98f50 new_whale w_99e4fe2 w_94c3bf0 w_64f4963
be8551936.jpg,new_whale w_1be76f5 w_9be2d22 w_9a9a2c8 w_ec16cc4
a8329ea6e.jpg,new_whale w_67a9841 w_190b9bb w_9f2fb13 w_60ce6fc
516b0d455.jpg,w_bc285a6 new_whale w_9cc2c36 w_bf7c89a w_e3e617e
43e638482.jpg,new_whale w_cc93694 w_6dbfd7a w_83b2336 w_a616378
cbf3f8509.jpg,w_27597ff new_whale w_eba33fb w_5871dfd w_450878a
29832f000.jpg,new_whale w_13c1b55 w_94e136e w_a113b33 w_c0a6881
14f237215.jpg,w_c0bf8f8 new_whale w_6cb1ff1 w_cb9f118 w_dfc9865
dc0838dd9.jpg,new_whale w_351a377 w_f78a4b1 w_85bb73c w_9712235
f91a9e58a.jpg,w_d602efb new_whale w_0a155b9 w_16b5050 w_bb08804
047b5bcb8.jpg,w_4b815d3 new_whale w_6dedb5c w_9d86594 w_3002b59
7b89b5edd.jpg,w_4bdd289 new_whale w_7ca2a9b w_94ea240 w_122eec1
dd115639d.jpg,new_whale w_06e6d5f w_0da34d3 w_69c06ad w_4562f42
3cfa1be0f.jpg,w_b3ca4b7 new_whale w_56a96ed w_d588fb4 w_3a241cf
bf0ac4a74.jpg,w_1faaf06 w_7aea0b8 new_whale w_4fa0ba1 w_2af46a8
2b4b8e5db.jpg,w_1c2e409 new_whale w_b5e6c9c w_0a0c768 w_f121f0c
d007a4159.jpg,w_66168f1 new_whale w_6fe3566 w_8c83452 w_b3afb40
7fe2d28c3.jpg,w_f64767d w_2c5fe7e new_whale w_fe95c92 w_5a0ef9f
473c55dc8.jpg,w_cd4cb49 new_whale w_9b5109b w_6b25530 w_7ce08e6
119f9d3f1.jpg,w_9b69214 new_whale w_7087c88 w_007fefa w_56d8530
332a57fe7.jpg,w_0e0f074 new_whale w_68ae353 w_5816f86 w_29c0caf
198dc886c.jpg,new_whale w_8d71480 w_a58d6d5 w_e090471 w_8e04a78
e1511ea87.jpg,w_5b8f665 new_whale w_03ad89c w_c89981f w_378bf61
a7c8fbf67.jpg,w_5535fd3 new_whale w_f24a2de w_3a63e33 w_7c26ef7
2a8537e27.jpg,w_704a8a1 new_whale w_7fcf284 w_f94fc92 w_dd837b1
0e389a8d8.jpg,w_20950a9 w_1b2bf0f new_whale w_a48fa24 w_ab7c369
99416c1c2.jpg,new_whale w_23a388d w_ad880b8 w_ab44ae4 w_f7cd240
a038a2f5b.jpg,w_5a90eff new_whale w_070036a w_aa2d6fc w_9a17ae9
5bc85f2fb.jpg,w_a3cbe89 new_whale w_e07b79f w_118a4a4 w_fe15413
b0d55416e.jpg,w_72f3685 new_whale w_61e136d w_8cce8ce w_06460d7
131c8a098.jpg,new_whale w_f546938 w_974c37d w_0f56fb2 w_595dbd3
4ffdbdcc8.jpg,w_490d198 new_whale w_3c64b50 w_a48fa24 w_5252dc7
d2eeb9436.jpg,new_whale w_94dcd2b w_36c8c0d w_f4a9357 w_ae536d6
14266a21b.jpg,w_9da1811 new_whale w_9a8c7dd w_beb062d w_9e73e1b
9c3eb58f0.jpg,w_d7b6f17 new_whale w_60c073b w_4c62681 w_5a8902d
06fdc1fd7.jpg,w_bd572cf new_whale w_72019ec w_0ad1734 w_2f74ff3
413c76d3f.jpg,w_a190a88 new_whale w_61e136d w_533fe25 w_8cee3d3
c5e83f557.jpg,new_whale w_c9a569d w_35f2f8d w_d1518b9 w_591a2c5
562021f42.jpg,w_8b86b95 new_whale w_415f090 w_53feb91 w_ee61a1f
df844a407.jpg,w_13edc47 new_whale w_cd4cb49 w_23d4815 w_38c6a8d
09ae7a1c4.jpg,new_whale w_3879fa0 w_86ecf59 w_b164c63 w_bb6217a
e5e19804e.jpg,w_8a10a82 new_whale w_937830e w_13aa123 w_edf43c1
7f2b134bb.jpg,new_whale w_7e579dd w_d6d2e4f w_5f20f03 w_a770c8f
8077058b5.jpg,w_9142b9c new_whale w_9e18daa w_fdf618d w_1c47899
14269c1e2.jpg,w_f0fe284 new_whale w_6c0cdb1 w_a8b65e2 w_94e136e
74ddb5ed2.jpg,w_89e559b new_whale w_950c471 w_c1b90d1 w_44fe688
afc72b500.jpg,w_cffd90e new_whale w_a059841 w_d405854 w_7af5b09
2a6d108cf.jpg,new_whale w_27aa28c w_2b388fe w_445a265 w_fdfd867
aee2b6592.jpg,w_88b3a3d new_whale w_716ac00 w_6e209a8 w_96c5fe0
67fba86c6.jpg,new_whale w_94a0d4e w_b441850 w_94f41dc w_8431ae8
c1643ef68.jpg,w_ce5c5eb new_whale w_8e9f047 w_8261f4d w_c073f96
a41fbf908.jpg,w_70db0cc new_whale w_62bedea w_52adbfa w_dc651ad
fd1c9799b.jpg,w_23ce00e new_whale w_98e83cc w_6f7667a w_38c8a8d
4d685a22c.jpg,w_eaed433 new_whale w_c01b2e9 w_b264d2a w_8a4618d
6d8e7abdb.jpg,new_whale w_32043b0 w_80dfb8e w_eaa5dbb w_1647882
8d2a42bfd.jpg,w_2d6596f new_whale w_8e1cf61 w_d0b330d w_9b6d9b7
cd157aece.jpg,w_5ae026a new_whale w_fbcd329 w_cda8eb8 w_c481650
80035b4ea.jpg,new_whale w_16b5050 w_0b7ce1e w_d84afa9 w_c80541e
847fda2fa.jpg,w_d2e4f28 new_whale w_8cce8ce w_8a1786f w_e5ad760
744133e51.jpg,w_a3d2008 new_whale w_22d96e7 w_1e286e0 w_dee8b12
a9ae7c984.jpg,w_3f7d5f5 new_whale w_4f6e5a9 w_688590b w_59052ad
bdf37eecb.jpg,w_778e474 new_whale w_c25deb9 w_2ed0d2f w_997cda5
f6a7a3c6a.jpg,new_whale w_4ab3420 w_8585e34 w_7c27fbd w_e73cce3
47166e300.jpg,new_whale w_3b03149 w_025911c w_072f593 w_6e6a6ff
e9ba4093f.jpg,w_9b5109b new_whale w_456646a w_eba33fb w_af1d57b
9ab4dd244.jpg,w_16def42 new_whale w_1b00c27 w_f5bf6df w_7e579dd
d003a9aaf.jpg,w_99c4cce new_whale w_985d205 w_dec9108 w_f4605bf
c1c2438b7.jpg,w_74b6ca2 new_whale w_049ae2e w_dea6580 w_f64767d
93a523c92.jpg,w_35e991b new_whale w_1b6f6dc w_e54d8f6 w_9eaef8f
640185dda.jpg,new_whale w_b495218 w_0ee9ae5 w_6579856 w_966f46a
4f326b886.jpg,new_whale w_fa478eb w_d9aecac w_f793b1f w_ec4299b
e5d4878fd.jpg,w_d892cd9 new_whale w_0a619af w_540ac0a w_a1b7b83
31b063adc.jpg,w_3729146 w_7d46ac3 new_whale w_64055b4 w_d0528f6
0e7fa6595.jpg,w_565d73a new_whale w_f8478b9 w_4096187 w_e145c7a
10c2ad09e.jpg,w_fb3959d new_whale w_f035513 w_bd18f3c w_b5c3634
599fb6ecf.jpg,w_85c5adf new_whale w_d0bf381 w_e6d46e4 w_4e902c2
b13fd31f9.jpg,w_4132bb8 new_whale w_c1b90d1 w_4e902c2 w_e918d4c
773429486.jpg,new_whale w_a9a3878 w_c1b90d1 w_db3cfa4 w_840061a
8cda71a2c.jpg,new_whale w_1106cbb w_3c966be w_0714a46 w_0ce537a
002fd89d4.jpg,new_whale w_aa585b1 w_2a946f2 w_9d95dee w_628d615
bc3795489.jpg,w_2ff0834 new_whale w_6ebfe7b w_bdb3a05 w_716ac00
05e145d7a.jpg,w_fd906cc new_whale w_e53bb95 w_4af7c01 w_6cda039
bb99151d0.jpg,new_whale w_b2af5eb w_263fcb0 w_edf43c1 w_cfe7928
7516e2af9.jpg,w_58d8bbd new_whale w_8e47efa w_6a8bad9 w_29a8580
a62729b91.jpg,w_8b943ef new_whale w_c63c580 w_7860ed5 w_6d8f72e
4e1426137.jpg,w_36b59be new_whale w_5a9abcf w_bc7de9f w_dc662ea
61ab8e061.jpg,new_whale w_fd99c63 w_3879fa0 w_58afeb2 w_e66ac81
b67849af9.jpg,w_71a1a08 new_whale w_e966f36 w_003bae6 w_b7b1472
2c9898495.jpg,w_fae4be5 w_f84e6e1 w_1d35a02 new_whale w_2745292
37624b560.jpg,new_whale w_0717f05 w_50707c4 w_d1836e5 w_83cc0ec
52a42c6cb.jpg,w_1ab568f new_whale w_830b95a w_7085ad6 w_4f3cebf
46b997839.jpg,w_3c8b9ea new_whale w_d8ae71c w_267c7e3 w_8d0d921
0ad5c7959.jpg,w_78fbecd new_whale w_f636f80 w_0a1fcd6 w_bc511b5
8da08a11a.jpg,w_c11f9d8 new_whale w_bc511b5 w_8ed7a45 w_eae8af4
6510e1481.jpg,w_0cbf1b3 new_whale w_78e7020 w_23a388d w_bfcad53
f3debc044.jpg,w_2103ca8 new_whale w_3b3f3ce w_50c4067 w_67153b4
2b6140ef0.jpg,w_194bea2 new_whale w_f9aab0c w_13937e4 w_c465f0b
3234bf468.jpg,w_62ecd30 new_whale w_553d1ef w_a6703dd w_42388df
3fd5daaf7.jpg,w_d4c30a9 new_whale w_0f466a5 w_8f1069a w_ded2682
3f37c5bb7.jpg,w_4516d31 w_bb2c919 new_whale w_23a388d w_a059841
d86724222.jpg,w_a58d6d5 new_whale w_32838db w_1d830c2 w_887c387
12ef74152.jpg,w_e014c37 new_whale w_5af08bc w_92c4ea5 w_6f3a3ec
3d5903acc.jpg,new_whale w_446a02d w_7e61174 w_53b6917 w_9490369
92029cbf5.jpg,w_49e0d44 new_whale w_cc1784d w_fd98539 w_e32ad9c
3d1716ba8.jpg,w_297503e new_whale w_c59d924 w_03ea6f9 w_60795e6
94083dba8.jpg,new_whale w_2623b69 w_927dcdc w_5e5fec6 w_5258623
f8c1fc67f.jpg,w_6172f4a new_whale w_0dfb4f6 w_7547b9a w_da15e00
4d31ac4d6.jpg,w_944ac4f new_whale w_6db266a w_ae70500 w_61ed07a
8694c9d9f.jpg,w_efa6b4a new_whale w_e54d8f6 w_ecd2318 w_0887d9b
4653c575c.jpg,new_whale w_2db0644 w_8e58103 w_538259a w_650f587
00ca82e74.jpg,new_whale w_c63fd83 w_34053b9 w_bb2cbcf w_1417bc8
1579e263b.jpg,w_bb2c919 new_whale w_fdd3687 w_4516d31 w_d72771c
b5657d46d.jpg,w_ea2d2f9 w_3789389 new_whale w_1f0cf0a w_836e895
bb53d003f.jpg,new_whale w_1e286e0 w_84dc8cd w_2a1a012 w_62fc862
940c4b1ec.jpg,new_whale w_bd1c3d5 w_0ecda0a w_8739af5 w_0bdc5d5
378f63826.jpg,w_62bb54b w_28218e1 new_whale w_49cd60d w_be4f189
5d0ca9ac4.jpg,w_f1acf49 new_whale w_bbf0c38 w_e31480f w_8936c44
f63bb53ec.jpg,w_e2e7384 new_whale w_b28898a w_d892cd9 w_10b4603
6a7458c1f.jpg,new_whale w_265ac62 w_8fb247e w_97074d8 w_b4841bd
c58e27a49.jpg,new_whale w_3c64b50 w_fd3e556 w_0fdf741 w_8739af5
4d24f03da.jpg,w_2b4b82e new_whale w_f74a89e w_2b069ba w_3f0fd95
29aafc83c.jpg,new_whale w_ac90846 w_902d8ef w_9cff87c w_17a4a41
771fc7aaf.jpg,new_whale w_0fe07b7 w_db0c461 w_595dbd3 w_289778b
f49d8738d.jpg,w_b19f2f9 new_whale w_734f6b5 w_75d4e65 w_e3956f5
46bc240d4.jpg,new_whale w_c7d8935 w_c5e1472 w_76a76ca w_57bc12e
0fc351278.jpg,w_d8a47de new_whale w_e6325d7 w_f829227 w_9884e90
bb46166dc.jpg,w_6df47c6 new_whale w_23a388d w_551f361 w_4cbf396
de528c7d3.jpg,new_whale w_4bf625b w_ef83760 w_78e6713 w_87b0e69
5cb418374.jpg,w_22b8752 new_whale w_203042e w_28218e1 w_c1efffb
5c89043e5.jpg,new_whale w_3f44881 w_b4cf4b1 w_059d9e0 w_1b1dd05
e4ac9e290.jpg,w_8ac1fd6 w_e966f36 new_whale w_e906edd w_0135f5f
ec772e45b.jpg,w_d0475b2 new_whale w_d51cb28 w_80dfb8e w_1d2d323
4358b4875.jpg,w_abc5af2 new_whale w_3fadd3e w_9f13096 w_5d67caa
c9fe2f848.jpg,w_659bdb8 new_whale w_9fecf9d w_2df85e7 w_fcf1d68
2c17e310c.jpg,w_8e1e84c new_whale w_8d9af77 w_c85ff1e w_40efb29
45b0f1167.jpg,w_f6c5343 new_whale w_a0534e5 w_28218e1 w_b3afb40
cab645621.jpg,w_ed50c26 new_whale w_df5bf3d w_9be2d22 w_32015c2
4c73b7bf5.jpg,w_ab7c369 new_whale w_d0728b9 w_57db059 w_659bdb8
811692fad.jpg,new_whale w_9d59be4 w_c797292 w_7c1435e w_e6d46e4
4511f2fca.jpg,w_169253a w_94e8c02 new_whale w_936aa13 w_b2606f3
2fe1492bd.jpg,w_450878a new_whale w_3eae264 w_73d71d2 w_9ed5f69
731cf3267.jpg,new_whale w_1d6a9f7 w_8340caf w_70d0b3c w_58ddf90
dfee439d2.jpg,w_523fb3a new_whale w_0637181 w_6af9b02 w_5c2c1a1
cfd6ecf8b.jpg,w_1a874a6 new_whale w_7d55653 w_32da935 w_99545ba
f390f4831.jpg,w_733e9cc w_d573a68 new_whale w_2dd6b62 w_21a7dac
20585c52c.jpg,w_007fefa new_whale w_f314516 w_6e97ef4 w_c0c4587
e07121789.jpg,w_a548534 new_whale w_836e895 w_1b4bb29 w_84f9ab0
c89982d23.jpg,new_whale w_242fb46 w_689cfe2 w_b1c5c0b w_367fb60
9617fa114.jpg,w_2c5fe7e w_f64767d new_whale w_27597ff w_23e1d57
2b1921219.jpg,w_2ad05e9 new_whale w_24e9b5d w_a6a1bea w_8b8dca8
d0a1a1af6.jpg,w_df86a42 new_whale w_95f78f6 w_0ee9ae5 w_700ebb4
460b15ff3.jpg,w_7b098ce new_whale w_752ffa2 w_57abc0f w_e1c9a18
1d8273e9c.jpg,w_c815410 new_whale w_4dac709 w_e6325d7 w_d8a47de
b1135fc29.jpg,w_cdf834e new_whale w_d15dd0b w_edf43c1 w_9f98ee1
311cbec8b.jpg,new_whale w_7a232d3 w_7983f71 w_ac0f6c4 w_b4cf4b1
e9cabaa8c.jpg,new_whale w_5833b3d w_45e277d w_343f088 w_298f605
53974e859.jpg,w_ef74616 new_whale w_6fed7c4 w_c8bbb43 w_f1d2222
8a4b5372a.jpg,w_8affab2 new_whale w_b72dc3d w_8dd3f4a w_540d5db
7cff6ba76.jpg,w_305456a new_whale w_68f23a1 w_59052ad w_555e037
6a37e5fa0.jpg,w_44a3ca5 new_whale w_d140497 w_b82d0eb w_8305a19
cdcdaf517.jpg,w_1ff1582 new_whale w_99c4cce w_711552b w_8103832
5667e77ae.jpg,w_ee318d3 new_whale w_c84b36b w_1b70f3f w_4669e6a
769e6d7e6.jpg,w_0f25e6b new_whale w_60b027a w_c87817e w_df5bf3d
2c4035b6b.jpg,new_whale w_553d1ef w_e4a9205 w_bc2369c w_27b7295
e664f88ee.jpg,w_ec7f1b3 new_whale w_0ee9ae5 w_e70a3d0 w_6c3ec2d
3d145ac9c.jpg,new_whale w_78ab4d4 w_a7ef9a5 w_9ba4a9a w_707ce0f
82bb38b0f.jpg,new_whale w_9713c92 w_9728637 w_3057209 w_510f3ee
d0b3fc9c5.jpg,w_6cfa650 new_whale w_2ab34d0 w_2211e6d w_69efdbe
7fcc33817.jpg,w_a6eaf8d new_whale w_264c2e1 w_1133530 w_cac9bdb
96b0ab1d9.jpg,new_whale w_d236b51 w_181ab06 w_00d50c9 w_e2ef16f
d4e408345.jpg,w_4f9c015 new_whale w_96c5fe0 w_c01c1f4 w_146208a
7d1337347.jpg,w_d15d8c5 new_whale w_95a5270 w_f6c5343 w_6b2a111
d6c4d75be.jpg,w_191bce3 new_whale w_7e2eb3d w_06313c8 w_46ccc6f
d31bd1979.jpg,w_6189444 new_whale w_17b0d3a w_62c78f3 w_a4ac5dd
7782ff4e9.jpg,w_23a388d new_whale w_5bf792a w_c8bbb43 w_ac835f9
f165401d0.jpg,w_706e4fb w_c1715f5 new_whale w_e27bbf6 w_1fc42e2
e2b2df4ad.jpg,new_whale w_e32ad9c w_9c506f6 w_eba33fb w_3bfa4f8
d31310f97.jpg,w_36828b8 new_whale w_00904a7 w_bfcad53 w_dc3e9cc
3f9017093.jpg,w_1ca9ab1 new_whale w_76e67dc w_adedd1f w_1d4e949
981b104fa.jpg,new_whale w_7547b9a w_878f5ba w_38de45d w_9e020d1
0e82ef15d.jpg,w_5a2634c new_whale w_6e6307e w_e090471 w_e1f57e7
1dcafff3d.jpg,w_3518604 new_whale w_8cfabed w_334c489 w_e533679
68ac1cbdc.jpg,w_1a619db new_whale w_d573a68 w_a386d0b w_844b91e
c603a25d0.jpg,w_e210cb5 new_whale w_fd99c63 w_3879fa0 w_2fdb049
37d2d4743.jpg,w_bc285a6 w_9cc2c36 new_whale w_5d687a9 w_ae8982d
0641ae9b5.jpg,w_84b1b28 w_163b2b8 new_whale w_022d2f5 w_0cfdaa5
982fd73d3.jpg,w_e210cb5 new_whale w_3879fa0 w_fd99c63 w_2fdb049
d72a65293.jpg,new_whale w_1ff1582 w_b86917d w_1ccea93 w_75fc10c
d0a10f620.jpg,w_ee864e4 new_whale w_fccac74 w_e36b021 w_7272aa5
29239ed83.jpg,w_3c33b23 new_whale w_8431ae8 w_2112103 w_0db2e26
60fcac50e.jpg,w_13250ab new_whale w_e26eb46 w_c1efffb w_eba33fb
be6b61ee4.jpg,w_aee6701 new_whale w_c178f34 w_5be4e45 w_f737a6c
4ee3d948d.jpg,w_9697236 new_whale w_c4c380f w_07cb113 w_ebe9709
1a5550c9a.jpg,new_whale w_abc82c3 w_d6aa3f3 w_e21b629 w_d9f8641
b403e73af.jpg,w_4bc3d74 new_whale w_e740b27 w_4eb6bcc w_ac73445
906aa36c8.jpg,w_fd6b0da new_whale w_0ac10f3 w_ab7c369 w_2c0f96c
98baeef76.jpg,new_whale w_fa11a3f w_8c25681 w_fa4034b w_3c4b1d0
953dd6f30.jpg,w_38de45d new_whale w_8003858 w_4797776 w_db0c461
4f2160ca8.jpg,new_whale w_07768b0 w_7b098ce w_cfeb24b w_1c63738
df5baee3a.jpg,w_3067220 new_whale w_06f3291 w_e3582ac w_7e38d10
8f5d2204a.jpg,w_ae09e99 new_whale w_efe3a39 w_4982a49 w_fe54484
ba2155ce5.jpg,w_fa478eb new_whale w_832917d w_1920193 w_789c969
77ed6d2b9.jpg,w_f829227 new_whale w_93fddcb w_21b2790 w_49ee8e0
ce944543c.jpg,new_whale w_bbfce38 w_625e590 w_b72cdc1 w_0bd39c1
86a1b2d8e.jpg,w_fd3e556 new_whale w_c1b34d2 w_1b51678 w_e0a42ad
da702e4d3.jpg,w_dd18ea8 new_whale w_7b2e5ce w_d9aecac w_4eb128b
2ba7a6ec7.jpg,w_f62bcba new_whale w_cf88f4b w_fbfe96b w_c4f01e2
60dfa4942.jpg,w_760c469 new_whale w_1e85eea w_81f8d47 w_6b1d160
7d5dbe602.jpg,w_73d71d2 new_whale w_5e8e218 w_6ab76e6 w_08630fd
c7df19923.jpg,w_262c32f w_a47dc2d new_whale w_f13f7b3 w_2fdb049
4e09edc85.jpg,w_da08395 new_whale w_fdf618d w_3791ec3 w_21ae2d7
8a6fff4ff.jpg,w_3040ecd new_whale w_db0c461 w_6f7611c w_8e1cf61
02cd0a66b.jpg,w_aee06ab new_whale w_4460861 w_b8a02a2 w_bc7de9f
a4caf15ab.jpg,new_whale w_5c6bd71 w_711b815 w_f24a55c w_0cfdaa5
fcfd57fe4.jpg,w_91cc02c new_whale w_60cf87c w_aee9487 w_6fc8edc
b87c3fc27.jpg,w_7a1c290 new_whale w_f66ec54 w_4eb128b w_c875e45
24bb8ad52.jpg,new_whale w_343f088 w_d7aef56 w_98cc97d w_ce59977
172d31128.jpg,new_whale w_a34d26b w_e486063 w_e0d3a78 w_9b5109b
dbedde3ad.jpg,new_whale w_91cc02c w_fd4376a w_95b8b64 w_4e63f7a
a93fe28ec.jpg,w_a059841 new_whale w_6301785 w_5f54045 w_65ffd7d
c68904c64.jpg,new_whale w_95b6fde w_7d91458 w_8d52508 w_62e5aa0
e3cb9f8a3.jpg,w_47098f8 new_whale w_3c880c2 w_27a6304 w_82ba482
ca553a2fc.jpg,w_3f93ee8 new_whale w_5515886 w_b128587 w_93ef4fa
09b7aab77.jpg,w_e008923 new_whale w_b7aa4d8 w_234713b w_972e51e
142df1989.jpg,w_c158581 new_whale w_07768b0 w_75f6ffa w_50e2184
c6b69de61.jpg,w_d6aa3f3 new_whale w_179c9f0 w_80b474e w_6a8bad9
b8ae0dd22.jpg,w_f61b957 new_whale w_ded330f w_fdd3687 w_8e74601
8a9f34d2f.jpg,w_86d0c34 new_whale w_4562f42 w_8f4d879 w_c2677ee
09685092f.jpg,w_87e5b68 new_whale w_ecd2318 w_8c25681 w_f91aeec
37f712e18.jpg,w_8d1a7ba new_whale w_700ebb4 w_eae91de w_1cb0ffc
6862bb06f.jpg,w_b3cc7b3 w_9bde64d new_whale w_e27bbf6 w_83a4279
2af53ac76.jpg,new_whale w_ef30316 w_01e1fe0 w_448e190 w_a053e56
28b4898c9.jpg,w_af367c3 new_whale w_ee61a1f w_0e4b65e w_cdf834e
6a72d84ca.jpg,w_be4f189 new_whale w_0bc078c w_c1efffb w_a47dc2d
ff880e445.jpg,w_b420d45 new_whale w_35b5c5d w_955bfe2 w_bcba9e8
71ef8b935.jpg,w_7a8ce16 new_whale w_074530d w_b1abd47 w_497efb9
15d7e8f44.jpg,w_eae8af4 new_whale w_a283c8c w_c875e45 w_1c55cc3
6afa3a2aa.jpg,w_a84be0c new_whale w_8b05f21 w_6fe3dac w_224bfc5
6cc9c8e7d.jpg,w_a687883 new_whale w_53215c6 w_c028816 w_1e283bb
5cfe64731.jpg,w_421b9de new_whale w_62e5aa0 w_bc733ec w_8d0d921
b12246033.jpg,w_60ce6fc new_whale w_f86b16b w_0e325b0 w_e3056e9
d33369034.jpg,w_9eb9853 new_whale w_5c2c1a1 w_da5b8fe w_88445b2
8d5b48c67.jpg,w_b0d1046 new_whale w_502e72f w_343f088 w_e8b5980
106b4a3dc.jpg,new_whale w_e107383 w_dc651ad w_68aa903 w_2a0e817
584c5a35b.jpg,w_b9131da new_whale w_98a87a6 w_28218e1 w_520731e
1187f0e93.jpg,w_0d5a672 new_whale w_a4826eb w_e6450bc w_0fe07b7
aae97577a.jpg,w_4678fbb new_whale w_3f7d5f5 w_f82777d w_5f5f9ae
2d9f66f9b.jpg,w_fcdda4c new_whale w_4ea4f59 w_aa0bd3b w_ec1eb03
314b198e9.jpg,w_e2e7384 new_whale w_d892cd9 w_2b388fe w_81d4bd6
4a63614dc.jpg,w_1f62b56 new_whale w_66168f1 w_8507818 w_d0528f6
56c19ff0f.jpg,w_b3197c6 new_whale w_3b03245 w_3de579a w_902d8ef
7a53bf555.jpg,w_d405854 new_whale w_ffe8693 w_4a28f21 w_7af5b09
d9005d7d7.jpg,new_whale w_64055b4 w_4a61e0a w_bc62c27 w_f11cbbc
8d626a232.jpg,new_whale w_054162a w_4c614f3 w_fc6f897 w_6ae4956
aa92ada1b.jpg,w_564a34b new_whale w_27b7295 w_8bc8a32 w_3002b59
47075d7d7.jpg,w_ffa542b new_whale w_8f2943e w_ccc26ea w_b495218
aabc5cf3b.jpg,w_6ca0970 new_whale w_37bdff9 w_eba33fb w_937830e
dfc94bfc2.jpg,w_56276b3 new_whale w_ac51301 w_c1d2fbe w_0f00df0
4fb4bed8c.jpg,new_whale w_6eb10d2 w_17be6f2 w_c0f1e04 w_37d2f3a
07910d9c9.jpg,new_whale w_9ad3618 w_fccac74 w_037b23f w_2db0644
f23b01cdf.jpg,w_20baeef new_whale w_0fdf741 w_69a58b2 w_eba33fb
69dc9942d.jpg,new_whale w_e1f57e7 w_c1efffb w_535448f w_efa895a
9d293bece.jpg,w_2f8eda5 new_whale w_01cbbbd w_4b609e1 w_8301946
08af2949e.jpg,new_whale w_91cc02c w_be4f189 w_9748a78 w_d3b1733
953e39b09.jpg,w_a32ff7f new_whale w_eba33fb w_8141e4e w_c1d2fbe
1b807793f.jpg,new_whale w_dadc1a5 w_9be2d22 w_90336d0 w_002c810
95e2e4fb8.jpg,w_9c506f6 new_whale w_1887b5a w_733f661 w_45e98c0
515c5d9f7.jpg,w_f119baa w_3f213d5 new_whale w_26db444 w_9c68fe8
df744b419.jpg,w_8340caf new_whale w_2972f31 w_ecd9cc4 w_782c71d
c41c3543a.jpg,w_03ea6f9 new_whale w_16df050 w_14bfbe2 w_d22e12a
44d735f0a.jpg,w_a8ebc69 new_whale w_50260e7 w_78de8f7 w_902f8b0
f1a00beed.jpg,w_9732911 new_whale w_ef30316 w_715b1b5 w_832917d
0453f9eb7.jpg,w_553d1ef new_whale w_68ed1f9 w_6f0cbe3 w_ac80688
79c7bec95.jpg,w_2e075b2 new_whale w_a41147a w_0714a46 w_ea520df
4ef8655da.jpg,w_4130233 w_cc93694 new_whale w_9739508 w_5a9abcf
1f98ffa0c.jpg,w_18934ab new_whale w_5773c71 w_030c8b0 w_a0fcfc1
33b792e06.jpg,w_3f22dc6 new_whale w_7307591 w_4e9b3a3 w_0823d50
